full_text,tweet_english
jaka sembung bawa ikan mas nyambung mas wkwkwk orang lg ngomongin situ kok nyebar hoax bilang kalau harvey moeis sm antekantek tom lembong anies cuman foto edit,MYMEMORY WARNING: YOU USED ALL AVAILABLE FREE TRANSLATIONS FOR TODAY. NEXT AVAILABLE IN  05 HOURS 55 MINUTES 13 SECONDS VISIT HTTPS://MYMEMORY.TRANSLATED.NET/DOC/USAGELIMITS.PHP TO TRANSLATE MORE
noh suara anies gelembung oranga dpo sekarang curang teriak curang,MYMEMORY WARNING: YOU USED ALL AVAILABLE FREE TRANSLATIONS FOR TODAY. NEXT AVAILABLE IN  05 HOURS 55 MINUTES 12 SECONDS VISIT HTTPS://MYMEMORY.TRANSLATED.NET/DOC/USAGELIMITS.PHP TO TRANSLATE MORE
gw cengeng liat org integritas malah mewek kyk udah mulai langka aja org2 integritas dunia politik tuh lama aku gamau tau ttg politik karna tau kotor tp akhir mau melek ajar karna anies baswedan,MYMEMORY WARNING: YOU USED ALL AVAILABLE FREE TRANSLATIONS FOR TODAY. NEXT AVAILABLE IN  05 HOURS 55 MINUTES 12 SECONDS VISIT HTTPS://MYMEMORY.TRANSLATED.NET/DOC/USAGELIMITS.PHP TO TRANSLATE MORE
pokok curang kalau anies menang baru benerrr otak,MYMEMORY WARNING: YOU USED ALL AVAILABLE FREE TRANSLATIONS FOR TODAY. NEXT AVAILABLE IN  05 HOURS 55 MINUTES 11 SECONDS VISIT HTTPS://MYMEMORY.TRANSLATED.NET/DOC/USAGELIMITS.PHP TO TRANSLATE MORE
gak bakal laden abah anies jauh dr level intelektual,MYMEMORY WARNING: YOU USED ALL AVAILABLE FREE TRANSLATIONS FOR TODAY. NEXT AVAILABLE IN  05 HOURS 55 MINUTES 10 SECONDS VISIT HTTPS://MYMEMORY.TRANSLATED.NET/DOC/USAGELIMITS.PHP TO TRANSLATE MORE
moga pak anies jadi presidenbiar tambang bocah bongkar,MYMEMORY WARNING: YOU USED ALL AVAILABLE FREE TRANSLATIONS FOR TODAY. NEXT AVAILABLE IN  05 HOURS 55 MINUTES 09 SECONDS VISIT HTTPS://MYMEMORY.TRANSLATED.NET/DOC/USAGELIMITS.PHP TO TRANSLATE MORE
panas kepala mu anies keok wkkwwk,MYMEMORY WARNING: YOU USED ALL AVAILABLE FREE TRANSLATIONS FOR TODAY. NEXT AVAILABLE IN  05 HOURS 55 MINUTES 09 SECONDS VISIT HTTPS://MYMEMORY.TRANSLATED.NET/DOC/USAGELIMITS.PHP TO TRANSLATE MORE
dukung anies sama anies sama aja banyak bacot doang anjeeng,MYMEMORY WARNING: YOU USED ALL AVAILABLE FREE TRANSLATIONS FOR TODAY. NEXT AVAILABLE IN  05 HOURS 55 MINUTES 08 SECONDS VISIT HTTPS://MYMEMORY.TRANSLATED.NET/DOC/USAGELIMITS.PHP TO TRANSLATE MORE
wajar anies dihadang pilih kalau anies pilih kpk uu lama kpk 57 sidik senior tarik kpk koruptor miskin,MYMEMORY WARNING: YOU USED ALL AVAILABLE FREE TRANSLATIONS FOR TODAY. NEXT AVAILABLE IN  05 HOURS 55 MINUTES 07 SECONDS VISIT HTTPS://MYMEMORY.TRANSLATED.NET/DOC/USAGELIMITS.PHP TO TRANSLATE MORE
anies potter malfoy fr vibenya cocok tp dgn tweak sesuai karakter masingmasing wkwwk,MYMEMORY WARNING: YOU USED ALL AVAILABLE FREE TRANSLATIONS FOR TODAY. NEXT AVAILABLE IN  05 HOURS 55 MINUTES 06 SECONDS VISIT HTTPS://MYMEMORY.TRANSLATED.NET/DOC/USAGELIMITS.PHP TO TRANSLATE MORE
wkwkwkw ngerepotin diri sendiri ajar anies,MYMEMORY WARNING: YOU USED ALL AVAILABLE FREE TRANSLATIONS FOR TODAY. NEXT AVAILABLE IN  05 HOURS 55 MINUTES 06 SECONDS VISIT HTTPS://MYMEMORY.TRANSLATED.NET/DOC/USAGELIMITS.PHP TO TRANSLATE MORE
bayang kalau gibran lantik jadi wapres bayang anies baswedan maju menang pilgub jakarta temu lantas gibran koordinasi selaras bijak anies wilayah sekitar,MYMEMORY WARNING: YOU USED ALL AVAILABLE FREE TRANSLATIONS FOR TODAY. NEXT AVAILABLE IN  05 HOURS 55 MINUTES 05 SECONDS VISIT HTTPS://MYMEMORY.TRANSLATED.NET/DOC/USAGELIMITS.PHP TO TRANSLATE MORE
emang suruh gugat kasih cerah bangsa alur2 nya cari adil hukjm dong pantes anti anies sekali 497t ddan 271t pd buat pesta pora mau lindung maling,MYMEMORY WARNING: YOU USED ALL AVAILABLE FREE TRANSLATIONS FOR TODAY. NEXT AVAILABLE IN  05 HOURS 55 MINUTES 04 SECONDS VISIT HTTPS://MYMEMORY.TRANSLATED.NET/DOC/USAGELIMITS.PHP TO TRANSLATE MORE
dh pedo anggap minor wth,MYMEMORY WARNING: YOU USED ALL AVAILABLE FREE TRANSLATIONS FOR TODAY. NEXT AVAILABLE IN  05 HOURS 55 MINUTES 03 SECONDS VISIT HTTPS://MYMEMORY.TRANSLATED.NET/DOC/USAGELIMITS.PHP TO TRANSLATE MORE
nape tak buang je,MYMEMORY WARNING: YOU USED ALL AVAILABLE FREE TRANSLATIONS FOR TODAY. NEXT AVAILABLE IN  05 HOURS 55 MINUTES 03 SECONDS VISIT HTTPS://MYMEMORY.TRANSLATED.NET/DOC/USAGELIMITS.PHP TO TRANSLATE MORE
seram bodo baca pasal cg mrsm tumpat tu,MYMEMORY WARNING: YOU USED ALL AVAILABLE FREE TRANSLATIONS FOR TODAY. NEXT AVAILABLE IN  05 HOURS 55 MINUTES 02 SECONDS VISIT HTTPS://MYMEMORY.TRANSLATED.NET/DOC/USAGELIMITS.PHP TO TRANSLATE MORE
sidang sengketa pilpres 2024 kpu sebut mohon aniesmuhaimin kabur jelas,MYMEMORY WARNING: YOU USED ALL AVAILABLE FREE TRANSLATIONS FOR TODAY. NEXT AVAILABLE IN  05 HOURS 55 MINUTES 01 SECONDS VISIT HTTPS://MYMEMORY.TRANSLATED.NET/DOC/USAGELIMITS.PHP TO TRANSLATE MORE
yg ngeledek yaman anies suruh baca sejarah merdeka republik indonesiakalau mau tinggal jangan habis waktu debat orang2 bodoh,MYMEMORY WARNING: YOU USED ALL AVAILABLE FREE TRANSLATIONS FOR TODAY. NEXT AVAILABLE IN  05 HOURS 55 MINUTES 00 SECONDS VISIT HTTPS://MYMEMORY.TRANSLATED.NET/DOC/USAGELIMITS.PHP TO TRANSLATE MORE
info loker parttime part time freelance freelancer ajar mahsiswa kuliah sekolah wfh iphone netflix disney viu joki wts wtb pc konser tiket debat milu capres cawapres amin anies imin pragi gibran mahfud 2n,MYMEMORY WARNING: YOU USED ALL AVAILABLE FREE TRANSLATIONS FOR TODAY. NEXT AVAILABLE IN  05 HOURS 55 MINUTES 00 SECONDS VISIT HTTPS://MYMEMORY.TRANSLATED.NET/DOC/USAGELIMITS.PHP TO TRANSLATE MORE
exo kalah mama 2017 jg grgr anies ikut pilgub jkt kak,MYMEMORY WARNING: YOU USED ALL AVAILABLE FREE TRANSLATIONS FOR TODAY. NEXT AVAILABLE IN  05 HOURS 54 MINUTES 59 SECONDS VISIT HTTPS://MYMEMORY.TRANSLATED.NET/DOC/USAGELIMITS.PHP TO TRANSLATE MORE
bjirrr masalah safrina aja anies salah kata nama orang public speakingnya bagus pinter laku gitu hah serius luuuu mau nyamain maba sama anies bro didnt even suppo01,MYMEMORY WARNING: YOU USED ALL AVAILABLE FREE TRANSLATIONS FOR TODAY. NEXT AVAILABLE IN  05 HOURS 54 MINUTES 58 SECONDS VISIT HTTPS://MYMEMORY.TRANSLATED.NET/DOC/USAGELIMITS.PHP TO TRANSLATE MORE
mon maap inimah halal tinggal ribet banget sumpah emang jaklingonya mejeng foto anies eh mah tetangga,MYMEMORY WARNING: YOU USED ALL AVAILABLE FREE TRANSLATIONS FOR TODAY. NEXT AVAILABLE IN  05 HOURS 54 MINUTES 57 SECONDS VISIT HTTPS://MYMEMORY.TRANSLATED.NET/DOC/USAGELIMITS.PHP TO TRANSLATE MORE
yg hebat abah anies manusia mahal negeri konoha tahun sampai2 rezim kerah segala daya upaya jegal,MYMEMORY WARNING: YOU USED ALL AVAILABLE FREE TRANSLATIONS FOR TODAY. NEXT AVAILABLE IN  05 HOURS 54 MINUTES 57 SECONDS VISIT HTTPS://MYMEMORY.TRANSLATED.NET/DOC/USAGELIMITS.PHP TO TRANSLATE MORE
mana ngerti si anies hal2 spt ituintinya paling benaryg busuk ubah enak jidat,MYMEMORY WARNING: YOU USED ALL AVAILABLE FREE TRANSLATIONS FOR TODAY. NEXT AVAILABLE IN  05 HOURS 54 MINUTES 56 SECONDS VISIT HTTPS://MYMEMORY.TRANSLATED.NET/DOC/USAGELIMITS.PHP TO TRANSLATE MORE
iya jir kayak udah menang bawa bawa pak anies,MYMEMORY WARNING: YOU USED ALL AVAILABLE FREE TRANSLATIONS FOR TODAY. NEXT AVAILABLE IN  05 HOURS 54 MINUTES 55 SECONDS VISIT HTTPS://MYMEMORY.TRANSLATED.NET/DOC/USAGELIMITS.PHP TO TRANSLATE MORE
jg nyalahin anies kira suami tom lembong dong,MYMEMORY WARNING: YOU USED ALL AVAILABLE FREE TRANSLATIONS FOR TODAY. NEXT AVAILABLE IN  05 HOURS 54 MINUTES 54 SECONDS VISIT HTTPS://MYMEMORY.TRANSLATED.NET/DOC/USAGELIMITS.PHP TO TRANSLATE MORE
orang takut masuk bui kl anies menang gugat mk,MYMEMORY WARNING: YOU USED ALL AVAILABLE FREE TRANSLATIONS FOR TODAY. NEXT AVAILABLE IN  05 HOURS 54 MINUTES 54 SECONDS VISIT HTTPS://MYMEMORY.TRANSLATED.NET/DOC/USAGELIMITS.PHP TO TRANSLATE MORE
anda anies baswedan maju pilgub dki jakarta 3 nama jadi lawan berat,MYMEMORY WARNING: YOU USED ALL AVAILABLE FREE TRANSLATIONS FOR TODAY. NEXT AVAILABLE IN  05 HOURS 54 MINUTES 53 SECONDS VISIT HTTPS://MYMEMORY.TRANSLATED.NET/DOC/USAGELIMITS.PHP TO TRANSLATE MORE
tunggu stress dulu si anies,MYMEMORY WARNING: YOU USED ALL AVAILABLE FREE TRANSLATIONS FOR TODAY. NEXT AVAILABLE IN  05 HOURS 54 MINUTES 52 SECONDS VISIT HTTPS://MYMEMORY.TRANSLATED.NET/DOC/USAGELIMITS.PHP TO TRANSLATE MORE
awal hina anies tamat,MYMEMORY WARNING: YOU USED ALL AVAILABLE FREE TRANSLATIONS FOR TODAY. NEXT AVAILABLE IN  05 HOURS 54 MINUTES 51 SECONDS VISIT HTTPS://MYMEMORY.TRANSLATED.NET/DOC/USAGELIMITS.PHP TO TRANSLATE MORE
anggap fitnah bang ntar jujur kan cuma webnya fitnah anies kata dukung,MYMEMORY WARNING: YOU USED ALL AVAILABLE FREE TRANSLATIONS FOR TODAY. NEXT AVAILABLE IN  05 HOURS 54 MINUTES 51 SECONDS VISIT HTTPS://MYMEMORY.TRANSLATED.NET/DOC/USAGELIMITS.PHP TO TRANSLATE MORE
alhamdulillah pak tom dam pak anies dpt pahala fitnah pak pak kng fitnah kli tegas dikit,MYMEMORY WARNING: YOU USED ALL AVAILABLE FREE TRANSLATIONS FOR TODAY. NEXT AVAILABLE IN  05 HOURS 54 MINUTES 50 SECONDS VISIT HTTPS://MYMEMORY.TRANSLATED.NET/DOC/USAGELIMITS.PHP TO TRANSLATE MORE
aja tiap hari nyenggol lak etnis ngakunya menang tp bahagia wkkw pak anies kalian claim kalah aja kalian senggol senggol wkwkw blm move on wkwkw,MYMEMORY WARNING: YOU USED ALL AVAILABLE FREE TRANSLATIONS FOR TODAY. NEXT AVAILABLE IN  05 HOURS 54 MINUTES 49 SECONDS VISIT HTTPS://MYMEMORY.TRANSLATED.NET/DOC/USAGELIMITS.PHP TO TRANSLATE MORE
kok yakin pak anies pak tawar tawar wong slogan rangkul semua alias kalo oposisi lebih baik,MYMEMORY WARNING: YOU USED ALL AVAILABLE FREE TRANSLATIONS FOR TODAY. NEXT AVAILABLE IN  05 HOURS 54 MINUTES 48 SECONDS VISIT HTTPS://MYMEMORY.TRANSLATED.NET/DOC/USAGELIMITS.PHP TO TRANSLATE MORE
peta politik pilgub dki jakarta 2024 lama tiga nama usung anies baswedan unggul atas kertas,MYMEMORY WARNING: YOU USED ALL AVAILABLE FREE TRANSLATIONS FOR TODAY. NEXT AVAILABLE IN  05 HOURS 54 MINUTES 48 SECONDS VISIT HTTPS://MYMEMORY.TRANSLATED.NET/DOC/USAGELIMITS.PHP TO TRANSLATE MORE
buzzer mca n buzzer pks emnk biang kalah 2x skrg anies kena apes tempel nabrak sono sini,MYMEMORY WARNING: YOU USED ALL AVAILABLE FREE TRANSLATIONS FOR TODAY. NEXT AVAILABLE IN  05 HOURS 54 MINUTES 47 SECONDS VISIT HTTPS://MYMEMORY.TRANSLATED.NET/DOC/USAGELIMITS.PHP TO TRANSLATE MORE
anies ganjar usak demokrasi sungguh,MYMEMORY WARNING: YOU USED ALL AVAILABLE FREE TRANSLATIONS FOR TODAY. NEXT AVAILABLE IN  05 HOURS 54 MINUTES 46 SECONDS VISIT HTTPS://MYMEMORY.TRANSLATED.NET/DOC/USAGELIMITS.PHP TO TRANSLATE MORE
milu ulang anies usah ajak,MYMEMORY WARNING: YOU USED ALL AVAILABLE FREE TRANSLATIONS FOR TODAY. NEXT AVAILABLE IN  05 HOURS 54 MINUTES 45 SECONDS VISIT HTTPS://MYMEMORY.TRANSLATED.NET/DOC/USAGELIMITS.PHP TO TRANSLATE MORE
jiah ni gw kutip komen lo perlu tanya elo elo mulai si gagal olok olok gagal lagi apa hubung sama elu gw ngurusin anies wkwkwk aneh,MYMEMORY WARNING: YOU USED ALL AVAILABLE FREE TRANSLATIONS FOR TODAY. NEXT AVAILABLE IN  05 HOURS 54 MINUTES 44 SECONDS VISIT HTTPS://MYMEMORY.TRANSLATED.NET/DOC/USAGELIMITS.PHP TO TRANSLATE MORE
info loker parttime part time freelance freelancer ajar mahsiswa kuliah sekolah wfh iphone netflix disney viu joki wts wtb pc konser tiket debat milu capres cawapres amin anies imin pragi gibran mahfud 2m,MYMEMORY WARNING: YOU USED ALL AVAILABLE FREE TRANSLATIONS FOR TODAY. NEXT AVAILABLE IN  05 HOURS 54 MINUTES 44 SECONDS VISIT HTTPS://MYMEMORY.TRANSLATED.NET/DOC/USAGELIMITS.PHP TO TRANSLATE MORE
analisis peluang petitum anies ganjar,MYMEMORY WARNING: YOU USED ALL AVAILABLE FREE TRANSLATIONS FOR TODAY. NEXT AVAILABLE IN  05 HOURS 54 MINUTES 43 SECONDS VISIT HTTPS://MYMEMORY.TRANSLATED.NET/DOC/USAGELIMITS.PHP TO TRANSLATE MORE
alhamdulillah salah satu untung jadi warga muslim jakarta terima kasih bapak anies gubernur belum perlu gembargembor menu buka gratis onoh udahlah gembargembor ngasih makan gratis nyata lama banget realisasi,MYMEMORY WARNING: YOU USED ALL AVAILABLE FREE TRANSLATIONS FOR TODAY. NEXT AVAILABLE IN  05 HOURS 54 MINUTES 42 SECONDS VISIT HTTPS://MYMEMORY.TRANSLATED.NET/DOC/USAGELIMITS.PHP TO TRANSLATE MORE
pak anies profil cendekiawan cerdas scr ilmu emosi spritual zaman dulu ayah ingin anak2nya sprt bj habibie skrg sbg ayah sy harap anak2 sprt pak ab paling minim mampu komunikasi emosi sprt beliau,MYMEMORY WARNING: YOU USED ALL AVAILABLE FREE TRANSLATIONS FOR TODAY. NEXT AVAILABLE IN  05 HOURS 54 MINUTES 41 SECONDS VISIT HTTPS://MYMEMORY.TRANSLATED.NET/DOC/USAGELIMITS.PHP TO TRANSLATE MORE
kosa kata anies kaya kangen bngt p anies,MYMEMORY WARNING: YOU USED ALL AVAILABLE FREE TRANSLATIONS FOR TODAY. NEXT AVAILABLE IN  05 HOURS 54 MINUTES 41 SECONDS VISIT HTTPS://MYMEMORY.TRANSLATED.NET/DOC/USAGELIMITS.PHP TO TRANSLATE MORE
iya coba tanya anies deh udah tau bakal milik bgapain kepedean nyapres,MYMEMORY WARNING: YOU USED ALL AVAILABLE FREE TRANSLATIONS FOR TODAY. NEXT AVAILABLE IN  05 HOURS 54 MINUTES 40 SECONDS VISIT HTTPS://MYMEMORY.TRANSLATED.NET/DOC/USAGELIMITS.PHP TO TRANSLATE MORE
anies si cundang politik awal sombong nilai rendah ps lalu balas mayoritas rakyat nilai rendah anies dgn pilih ps unggul ngetop mantap 1 putar pilpres good sekarang harap tangkap angin mk,MYMEMORY WARNING: YOU USED ALL AVAILABLE FREE TRANSLATIONS FOR TODAY. NEXT AVAILABLE IN  05 HOURS 54 MINUTES 39 SECONDS VISIT HTTPS://MYMEMORY.TRANSLATED.NET/DOC/USAGELIMITS.PHP TO TRANSLATE MORE
istiqomah pak anies insya allah ri1 kebelet pingin punya presiden elegan matang,MYMEMORY WARNING: YOU USED ALL AVAILABLE FREE TRANSLATIONS FOR TODAY. NEXT AVAILABLE IN  05 HOURS 54 MINUTES 38 SECONDS VISIT HTTPS://MYMEMORY.TRANSLATED.NET/DOC/USAGELIMITS.PHP TO TRANSLATE MORE
orang kaga d promosiin y jarang org tau gengsi krn buat anies,MYMEMORY WARNING: YOU USED ALL AVAILABLE FREE TRANSLATIONS FOR TODAY. NEXT AVAILABLE IN  05 HOURS 54 MINUTES 38 SECONDS VISIT HTTPS://MYMEMORY.TRANSLATED.NET/DOC/USAGELIMITS.PHP TO TRANSLATE MORE
yo gibran tangkap dong anies tom lembong kata dukung kalian anies tom lembong kait korupsi ayo minta data dukung kalian aku tunggu kalian proses anies tom lembong tunggu woy nieh guentag bapak loe biar bantu,MYMEMORY WARNING: YOU USED ALL AVAILABLE FREE TRANSLATIONS FOR TODAY. NEXT AVAILABLE IN  05 HOURS 54 MINUTES 37 SECONDS VISIT HTTPS://MYMEMORY.TRANSLATED.NET/DOC/USAGELIMITS.PHP TO TRANSLATE MORE
bandung macet salah anies,MYMEMORY WARNING: YOU USED ALL AVAILABLE FREE TRANSLATIONS FOR TODAY. NEXT AVAILABLE IN  05 HOURS 54 MINUTES 36 SECONDS VISIT HTTPS://MYMEMORY.TRANSLATED.NET/DOC/USAGELIMITS.PHP TO TRANSLATE MORE
ayo lapor dong tangkap anies tom lembong aku tunggu kalian lapor ayo bantu dukung kalian nih 2x24 jam tangkap dong tunggu berita,MYMEMORY WARNING: YOU USED ALL AVAILABLE FREE TRANSLATIONS FOR TODAY. NEXT AVAILABLE IN  05 HOURS 54 MINUTES 35 SECONDS VISIT HTTPS://MYMEMORY.TRANSLATED.NET/DOC/USAGELIMITS.PHP TO TRANSLATE MORE
aku orang guru madrasah simpul anies bukan anak murid madrasah beri nilai jeblok,MYMEMORY WARNING: YOU USED ALL AVAILABLE FREE TRANSLATIONS FOR TODAY. NEXT AVAILABLE IN  05 HOURS 54 MINUTES 35 SECONDS VISIT HTTPS://MYMEMORY.TRANSLATED.NET/DOC/USAGELIMITS.PHP TO TRANSLATE MORE
lapor dong berani kalian kan udah punya bukti tangkap tuh tom lembong berani ayo lapor kpk jokowi mumpung kuasa aku tunggu kalian lapor tangkap anies tom lembong ayo dukung kalian punya bukti tangkap dong berani ga,MYMEMORY WARNING: YOU USED ALL AVAILABLE FREE TRANSLATIONS FOR TODAY. NEXT AVAILABLE IN  05 HOURS 54 MINUTES 34 SECONDS VISIT HTTPS://MYMEMORY.TRANSLATED.NET/DOC/USAGELIMITS.PHP TO TRANSLATE MORE
perempuan coba adu baca arquran pak anies buk apa anis buat salah sama ibu ibu bicara cuma ketawain sama pak anis bu selevelsadar bu segera tobat,MYMEMORY WARNING: YOU USED ALL AVAILABLE FREE TRANSLATIONS FOR TODAY. NEXT AVAILABLE IN  05 HOURS 54 MINUTES 33 SECONDS VISIT HTTPS://MYMEMORY.TRANSLATED.NET/DOC/USAGELIMITS.PHP TO TRANSLATE MORE
milih jadi presiden pilih jalan usaha tepat milih anies sesat kalah sombong gimana kalau menang besok senin selesai cantik nabrak,MYMEMORY WARNING: YOU USED ALL AVAILABLE FREE TRANSLATIONS FOR TODAY. NEXT AVAILABLE IN  05 HOURS 54 MINUTES 32 SECONDS VISIT HTTPS://MYMEMORY.TRANSLATED.NET/DOC/USAGELIMITS.PHP TO TRANSLATE MORE
maksud 01 sengaja curang biar kabul tuntut mk anies memang jenius,MYMEMORY WARNING: YOU USED ALL AVAILABLE FREE TRANSLATIONS FOR TODAY. NEXT AVAILABLE IN  05 HOURS 54 MINUTES 32 SECONDS VISIT HTTPS://MYMEMORY.TRANSLATED.NET/DOC/USAGELIMITS.PHP TO TRANSLATE MORE
kok mas anies sih,MYMEMORY WARNING: YOU USED ALL AVAILABLE FREE TRANSLATIONS FOR TODAY. NEXT AVAILABLE IN  05 HOURS 54 MINUTES 31 SECONDS VISIT HTTPS://MYMEMORY.TRANSLATED.NET/DOC/USAGELIMITS.PHP TO TRANSLATE MORE
kalo presiden mas anies kalo mana peduli bagus rakyat bikin bodoh miskin terus2an,MYMEMORY WARNING: YOU USED ALL AVAILABLE FREE TRANSLATIONS FOR TODAY. NEXT AVAILABLE IN  05 HOURS 54 MINUTES 30 SECONDS VISIT HTTPS://MYMEMORY.TRANSLATED.NET/DOC/USAGELIMITS.PHP TO TRANSLATE MORE
knp mau anies undang menang kok minta undang kalo anies undang alhamdulillah ucap kan munafik,MYMEMORY WARNING: YOU USED ALL AVAILABLE FREE TRANSLATIONS FOR TODAY. NEXT AVAILABLE IN  05 HOURS 54 MINUTES 29 SECONDS VISIT HTTPS://MYMEMORY.TRANSLATED.NET/DOC/USAGELIMITS.PHP TO TRANSLATE MORE
temu dapat samsung smartband m8 100 original smart band 8 waterproof touch screen heartbeat monitor blood pressure monitor smartwatch jam tangan smartwatch rp77000 shopee sekarang,MYMEMORY WARNING: YOU USED ALL AVAILABLE FREE TRANSLATIONS FOR TODAY. NEXT AVAILABLE IN  05 HOURS 54 MINUTES 29 SECONDS VISIT HTTPS://MYMEMORY.TRANSLATED.NET/DOC/USAGELIMITS.PHP TO TRANSLATE MORE
ganjar sbg kotak kosong misi utama suara oposisi pecah tdk semua anies pdip pilih utama kpd si wiwi tetap enak main boneka keluarga,MYMEMORY WARNING: YOU USED ALL AVAILABLE FREE TRANSLATIONS FOR TODAY. NEXT AVAILABLE IN  05 HOURS 54 MINUTES 28 SECONDS VISIT HTTPS://MYMEMORY.TRANSLATED.NET/DOC/USAGELIMITS.PHP TO TRANSLATE MORE
psi butuh kaesang warga jakarta butuh butuh sosok anies,MYMEMORY WARNING: YOU USED ALL AVAILABLE FREE TRANSLATIONS FOR TODAY. NEXT AVAILABLE IN  05 HOURS 54 MINUTES 27 SECONDS VISIT HTTPS://MYMEMORY.TRANSLATED.NET/DOC/USAGELIMITS.PHP TO TRANSLATE MORE
amat saran anies jangan turun level pilgub dki jakarta,MYMEMORY WARNING: YOU USED ALL AVAILABLE FREE TRANSLATIONS FOR TODAY. NEXT AVAILABLE IN  05 HOURS 54 MINUTES 26 SECONDS VISIT HTTPS://MYMEMORY.TRANSLATED.NET/DOC/USAGELIMITS.PHP TO TRANSLATE MORE
kalau pak anies iya gk punya partai pan pdip bro partai tu bos,MYMEMORY WARNING: YOU USED ALL AVAILABLE FREE TRANSLATIONS FOR TODAY. NEXT AVAILABLE IN  05 HOURS 54 MINUTES 26 SECONDS VISIT HTTPS://MYMEMORY.TRANSLATED.NET/DOC/USAGELIMITS.PHP TO TRANSLATE MORE
kaum nista anies si imam mahdi,MYMEMORY WARNING: YOU USED ALL AVAILABLE FREE TRANSLATIONS FOR TODAY. NEXT AVAILABLE IN  05 HOURS 54 MINUTES 25 SECONDS VISIT HTTPS://MYMEMORY.TRANSLATED.NET/DOC/USAGELIMITS.PHP TO TRANSLATE MORE
nih presiden pilih undang cina masa negara besar paham jg siapa menang cina loh cina cukk undang tau siapa menang mau halu jg lu pasu anies kasi lu,MYMEMORY WARNING: YOU USED ALL AVAILABLE FREE TRANSLATIONS FOR TODAY. NEXT AVAILABLE IN  05 HOURS 54 MINUTES 24 SECONDS VISIT HTTPS://MYMEMORY.TRANSLATED.NET/DOC/USAGELIMITS.PHP TO TRANSLATE MORE
kata kata ibu pantas ibu sendiri tdk pantas ucap buat p aniessht trsp anies smg allah kurang dosa dosa p anies,MYMEMORY WARNING: YOU USED ALL AVAILABLE FREE TRANSLATIONS FOR TODAY. NEXT AVAILABLE IN  05 HOURS 54 MINUTES 23 SECONDS VISIT HTTPS://MYMEMORY.TRANSLATED.NET/DOC/USAGELIMITS.PHP TO TRANSLATE MORE
iya reply masalah si sender isi komennya bawa2 pak anies klo paslon jelas banyak jg komentar cuma banding jujur cuma pak anies doang paling banyak dibawa2 konten relate sama sekali dijadiin bahan2 lelucon,MYMEMORY WARNING: YOU USED ALL AVAILABLE FREE TRANSLATIONS FOR TODAY. NEXT AVAILABLE IN  05 HOURS 54 MINUTES 23 SECONDS VISIT HTTPS://MYMEMORY.TRANSLATED.NET/DOC/USAGELIMITS.PHP TO TRANSLATE MORE
nieh tag ayo woy tangkap anies dukung kalian punya banyak bukti,MYMEMORY WARNING: YOU USED ALL AVAILABLE FREE TRANSLATIONS FOR TODAY. NEXT AVAILABLE IN  05 HOURS 54 MINUTES 22 SECONDS VISIT HTTPS://MYMEMORY.TRANSLATED.NET/DOC/USAGELIMITS.PHP TO TRANSLATE MORE
ngarep banget kasih selamat sama pak anies,MYMEMORY WARNING: YOU USED ALL AVAILABLE FREE TRANSLATIONS FOR TODAY. NEXT AVAILABLE IN  05 HOURS 54 MINUTES 21 SECONDS VISIT HTTPS://MYMEMORY.TRANSLATED.NET/DOC/USAGELIMITS.PHP TO TRANSLATE MORE
kalau kalian punya bukti lapor aja kpk ayo dong lapor kpk mumpung jokowi kuasa tunggu nieh gebrak dukung jokowi prabowogibran jangan cuman bikin berani lapor kpk tunggu berita anies tangkap kpk nih,MYMEMORY WARNING: YOU USED ALL AVAILABLE FREE TRANSLATIONS FOR TODAY. NEXT AVAILABLE IN  05 HOURS 54 MINUTES 20 SECONDS VISIT HTTPS://MYMEMORY.TRANSLATED.NET/DOC/USAGELIMITS.PHP TO TRANSLATE MORE
sayang banyak mau terangterangan dukung pk anies pilpres mungkin takut,MYMEMORY WARNING: YOU USED ALL AVAILABLE FREE TRANSLATIONS FOR TODAY. NEXT AVAILABLE IN  05 HOURS 54 MINUTES 20 SECONDS VISIT HTTPS://MYMEMORY.TRANSLATED.NET/DOC/USAGELIMITS.PHP TO TRANSLATE MORE
iyh bgtulah pak anies nemuin anggar janggal lem aibon sama pulpen aja bilang korupsi v,MYMEMORY WARNING: YOU USED ALL AVAILABLE FREE TRANSLATIONS FOR TODAY. NEXT AVAILABLE IN  05 HOURS 54 MINUTES 19 SECONDS VISIT HTTPS://MYMEMORY.TRANSLATED.NET/DOC/USAGELIMITS.PHP TO TRANSLATE MORE
haikal nilai anies provokasi pecah rakyat lewat news,MYMEMORY WARNING: YOU USED ALL AVAILABLE FREE TRANSLATIONS FOR TODAY. NEXT AVAILABLE IN  05 HOURS 54 MINUTES 18 SECONDS VISIT HTTPS://MYMEMORY.TRANSLATED.NET/DOC/USAGELIMITS.PHP TO TRANSLATE MORE
ngantuk,MYMEMORY WARNING: YOU USED ALL AVAILABLE FREE TRANSLATIONS FOR TODAY. NEXT AVAILABLE IN  05 HOURS 54 MINUTES 17 SECONDS VISIT HTTPS://MYMEMORY.TRANSLATED.NET/DOC/USAGELIMITS.PHP TO TRANSLATE MORE
uwwuuu nurien dh main twitter,MYMEMORY WARNING: YOU USED ALL AVAILABLE FREE TRANSLATIONS FOR TODAY. NEXT AVAILABLE IN  05 HOURS 54 MINUTES 17 SECONDS VISIT HTTPS://MYMEMORY.TRANSLATED.NET/DOC/USAGELIMITS.PHP TO TRANSLATE MORE
hahaha lucu drama jersey kali inget ernanda beberapa fans gabisa lu ganggu gugat fans sepakbola leslar anies akhir kpop focus on your life aja nanda,MYMEMORY WARNING: YOU USED ALL AVAILABLE FREE TRANSLATIONS FOR TODAY. NEXT AVAILABLE IN  05 HOURS 54 MINUTES 16 SECONDS VISIT HTTPS://MYMEMORY.TRANSLATED.NET/DOC/USAGELIMITS.PHP TO TRANSLATE MORE
bosan postingan pak de citra mulu posting masalah sengketa pilpres dimk sorot pasang aniesimin pranowo mahfud md intervensi balik pilpres,MYMEMORY WARNING: YOU USED ALL AVAILABLE FREE TRANSLATIONS FOR TODAY. NEXT AVAILABLE IN  05 HOURS 54 MINUTES 15 SECONDS VISIT HTTPS://MYMEMORY.TRANSLATED.NET/DOC/USAGELIMITS.PHP TO TRANSLATE MORE
udah lah maudy asmara apa malu jelek2in mulu pdhl lu injek negara bliau pimpin uang dri anies kurang,MYMEMORY WARNING: YOU USED ALL AVAILABLE FREE TRANSLATIONS FOR TODAY. NEXT AVAILABLE IN  05 HOURS 54 MINUTES 14 SECONDS VISIT HTTPS://MYMEMORY.TRANSLATED.NET/DOC/USAGELIMITS.PHP TO TRANSLATE MORE
ha cepat cepat pecut,MYMEMORY WARNING: YOU USED ALL AVAILABLE FREE TRANSLATIONS FOR TODAY. NEXT AVAILABLE IN  05 HOURS 54 MINUTES 14 SECONDS VISIT HTTPS://MYMEMORY.TRANSLATED.NET/DOC/USAGELIMITS.PHP TO TRANSLATE MORE
dahsyat bahaya negara manusia mahal abad anies rasy lewat,MYMEMORY WARNING: YOU USED ALL AVAILABLE FREE TRANSLATIONS FOR TODAY. NEXT AVAILABLE IN  05 HOURS 54 MINUTES 13 SECONDS VISIT HTTPS://MYMEMORY.TRANSLATED.NET/DOC/USAGELIMITS.PHP TO TRANSLATE MORE
aku sih yes gatau kalo mas anies,MYMEMORY WARNING: YOU USED ALL AVAILABLE FREE TRANSLATIONS FOR TODAY. NEXT AVAILABLE IN  05 HOURS 54 MINUTES 12 SECONDS VISIT HTTPS://MYMEMORY.TRANSLATED.NET/DOC/USAGELIMITS.PHP TO TRANSLATE MORE
bunga api ni macam esok pulak raya,MYMEMORY WARNING: YOU USED ALL AVAILABLE FREE TRANSLATIONS FOR TODAY. NEXT AVAILABLE IN  05 HOURS 54 MINUTES 11 SECONDS VISIT HTTPS://MYMEMORY.TRANSLATED.NET/DOC/USAGELIMITS.PHP TO TRANSLATE MORE
gugat aniesimin masuk ranah mk,MYMEMORY WARNING: YOU USED ALL AVAILABLE FREE TRANSLATIONS FOR TODAY. NEXT AVAILABLE IN  05 HOURS 54 MINUTES 11 SECONDS VISIT HTTPS://MYMEMORY.TRANSLATED.NET/DOC/USAGELIMITS.PHP TO TRANSLATE MORE
gak terima kalah anies tuduh milu curang,MYMEMORY WARNING: YOU USED ALL AVAILABLE FREE TRANSLATIONS FOR TODAY. NEXT AVAILABLE IN  05 HOURS 54 MINUTES 10 SECONDS VISIT HTTPS://MYMEMORY.TRANSLATED.NET/DOC/USAGELIMITS.PHP TO TRANSLATE MORE
kpu sebut mohon anies muhaimin kabur jelas,MYMEMORY WARNING: YOU USED ALL AVAILABLE FREE TRANSLATIONS FOR TODAY. NEXT AVAILABLE IN  05 HOURS 54 MINUTES 09 SECONDS VISIT HTTPS://MYMEMORY.TRANSLATED.NET/DOC/USAGELIMITS.PHP TO TRANSLATE MORE
biarin aja om pak anies jadi besar krn orang2 model begini,MYMEMORY WARNING: YOU USED ALL AVAILABLE FREE TRANSLATIONS FOR TODAY. NEXT AVAILABLE IN  05 HOURS 54 MINUTES 08 SECONDS VISIT HTTPS://MYMEMORY.TRANSLATED.NET/DOC/USAGELIMITS.PHP TO TRANSLATE MORE
ibu pernah rugi apa sama pak anies kok benci sama beliau,MYMEMORY WARNING: YOU USED ALL AVAILABLE FREE TRANSLATIONS FOR TODAY. NEXT AVAILABLE IN  05 HOURS 54 MINUTES 08 SECONDS VISIT HTTPS://MYMEMORY.TRANSLATED.NET/DOC/USAGELIMITS.PHP TO TRANSLATE MORE
kuasa hukum aniesmuhaimin amin ari yusuf amir minta mahkamah konstitusi mk hadir empat menteri saksi sidang selisih hasil pilih umum phpu sengketa pilpres 2024 empat menteri maksud menteri uang sri mulyani,MYMEMORY WARNING: YOU USED ALL AVAILABLE FREE TRANSLATIONS FOR TODAY. NEXT AVAILABLE IN  05 HOURS 54 MINUTES 07 SECONDS VISIT HTTPS://MYMEMORY.TRANSLATED.NET/DOC/USAGELIMITS.PHP TO TRANSLATE MORE
program baru nya biden niru kak makan siang wkwkwk program ujung nya siapa pilih bakal pake baik anies atau ganjar,MYMEMORY WARNING: YOU USED ALL AVAILABLE FREE TRANSLATIONS FOR TODAY. NEXT AVAILABLE IN  05 HOURS 54 MINUTES 06 SECONDS VISIT HTTPS://MYMEMORY.TRANSLATED.NET/DOC/USAGELIMITS.PHP TO TRANSLATE MORE
