full_text,tweet_english
awkwkwwkwkwk emgggg debat sm dukung owo mrk menang cara debat ajh tp statement keluarin sampah semua apa ngatain bokep sm anies imam mahdi padahal dukung kakek kakek langgar ham sm ipk 23,MYMEMORY WARNING: YOU USED ALL AVAILABLE FREE TRANSLATIONS FOR TODAY. NEXT AVAILABLE IN  05 HOURS 54 MINUTES 05 SECONDS VISIT HTTPS://MYMEMORY.TRANSLATED.NET/DOC/USAGELIMITS.PHP TO TRANSLATE MORE
semua salah pak anies,MYMEMORY WARNING: YOU USED ALL AVAILABLE FREE TRANSLATIONS FOR TODAY. NEXT AVAILABLE IN  05 HOURS 54 MINUTES 05 SECONDS VISIT HTTPS://MYMEMORY.TRANSLATED.NET/DOC/USAGELIMITS.PHP TO TRANSLATE MORE
info loker parttime part time freelance freelancer ajar mahsiswa kuliah sekolah wfh iphone netflix disney viu joki wts wtb pc konser tiket debat milu capres cawapres amin anies imin pragi gibran mahfud 2l,MYMEMORY WARNING: YOU USED ALL AVAILABLE FREE TRANSLATIONS FOR TODAY. NEXT AVAILABLE IN  05 HOURS 54 MINUTES 04 SECONDS VISIT HTTPS://MYMEMORY.TRANSLATED.NET/DOC/USAGELIMITS.PHP TO TRANSLATE MORE
hahahahahhah plisss banget jadi keinget meme andal afra mas anies mas anies,MYMEMORY WARNING: YOU USED ALL AVAILABLE FREE TRANSLATIONS FOR TODAY. NEXT AVAILABLE IN  05 HOURS 54 MINUTES 03 SECONDS VISIT HTTPS://MYMEMORY.TRANSLATED.NET/DOC/USAGELIMITS.PHP TO TRANSLATE MORE
anies memang pintar pintar tata kata,MYMEMORY WARNING: YOU USED ALL AVAILABLE FREE TRANSLATIONS FOR TODAY. NEXT AVAILABLE IN  05 HOURS 54 MINUTES 02 SECONDS VISIT HTTPS://MYMEMORY.TRANSLATED.NET/DOC/USAGELIMITS.PHP TO TRANSLATE MORE
tuju ahahahhh biar mampus 2 kota sekali ahahhahaha delusional dogs asli mikir anies jadi pimpin apa bawa aceh padang pls pas uda rusak 2 provinsi baru bangga gw ama anies mayoritas islam jg pecah belah ntar hahahaha,MYMEMORY WARNING: YOU USED ALL AVAILABLE FREE TRANSLATIONS FOR TODAY. NEXT AVAILABLE IN  05 HOURS 54 MINUTES 02 SECONDS VISIT HTTPS://MYMEMORY.TRANSLATED.NET/DOC/USAGELIMITS.PHP TO TRANSLATE MORE
anies kalah pilpres lihat santai santai aja lo jadi caleg gagal lihat beban hidup lo berat sekali bro ikhlasin aja mungkin masyarakat percaya tipikal kader kader emper kaki lima macam lo,MYMEMORY WARNING: YOU USED ALL AVAILABLE FREE TRANSLATIONS FOR TODAY. NEXT AVAILABLE IN  05 HOURS 54 MINUTES 01 SECONDS VISIT HTTPS://MYMEMORY.TRANSLATED.NET/DOC/USAGELIMITS.PHP TO TRANSLATE MORE
korupsi bakal ngaruh pimpin ntah jadi anies tetep aja korupsi ngaruh mimpi siapa korupsi orang korupsi sadar,MYMEMORY WARNING: YOU USED ALL AVAILABLE FREE TRANSLATIONS FOR TODAY. NEXT AVAILABLE IN  05 HOURS 54 MINUTES 00 SECONDS VISIT HTTPS://MYMEMORY.TRANSLATED.NET/DOC/USAGELIMITS.PHP TO TRANSLATE MORE
pendopo pak anies,MYMEMORY WARNING: YOU USED ALL AVAILABLE FREE TRANSLATIONS FOR TODAY. NEXT AVAILABLE IN  05 HOURS 53 MINUTES 59 SECONDS VISIT HTTPS://MYMEMORY.TRANSLATED.NET/DOC/USAGELIMITS.PHP TO TRANSLATE MORE
anak abah pak anies,MYMEMORY WARNING: YOU USED ALL AVAILABLE FREE TRANSLATIONS FOR TODAY. NEXT AVAILABLE IN  05 HOURS 53 MINUTES 59 SECONDS VISIT HTTPS://MYMEMORY.TRANSLATED.NET/DOC/USAGELIMITS.PHP TO TRANSLATE MORE
ketemu anies donk,MYMEMORY WARNING: YOU USED ALL AVAILABLE FREE TRANSLATIONS FOR TODAY. NEXT AVAILABLE IN  05 HOURS 53 MINUTES 58 SECONDS VISIT HTTPS://MYMEMORY.TRANSLATED.NET/DOC/USAGELIMITS.PHP TO TRANSLATE MORE
aku baru tau nyata pa anies orang kumpul ulama ulama internasional mashallah bener2 bikin cengang banget sama fakta2 beliau,MYMEMORY WARNING: YOU USED ALL AVAILABLE FREE TRANSLATIONS FOR TODAY. NEXT AVAILABLE IN  05 HOURS 53 MINUTES 57 SECONDS VISIT HTTPS://MYMEMORY.TRANSLATED.NET/DOC/USAGELIMITS.PHP TO TRANSLATE MORE
bacot doang sosmed maju sana jadi saksi mk kalo memang lu ubah hasil pilpres ngebet banget kan lu kalo anies menang cari pimpin kok pecah belah aneh pinter kok liat goblok,MYMEMORY WARNING: YOU USED ALL AVAILABLE FREE TRANSLATIONS FOR TODAY. NEXT AVAILABLE IN  05 HOURS 53 MINUTES 56 SECONDS VISIT HTTPS://MYMEMORY.TRANSLATED.NET/DOC/USAGELIMITS.PHP TO TRANSLATE MORE
amin allah amin kunpakun jadi pak anies presiden ri,MYMEMORY WARNING: YOU USED ALL AVAILABLE FREE TRANSLATIONS FOR TODAY. NEXT AVAILABLE IN  05 HOURS 53 MINUTES 56 SECONDS VISIT HTTPS://MYMEMORY.TRANSLATED.NET/DOC/USAGELIMITS.PHP TO TRANSLATE MORE
aku milih anies tuh relate relateee aku keluarga middle miskin engga kaya engga jadi yahhhh mau gimana menang si onoh,MYMEMORY WARNING: YOU USED ALL AVAILABLE FREE TRANSLATIONS FOR TODAY. NEXT AVAILABLE IN  05 HOURS 53 MINUTES 55 SECONDS VISIT HTTPS://MYMEMORY.TRANSLATED.NET/DOC/USAGELIMITS.PHP TO TRANSLATE MORE
pernah dengar cerita beberapa tahun lalu kalau anies gk jadi presiden masuk penjara kena kasus,MYMEMORY WARNING: YOU USED ALL AVAILABLE FREE TRANSLATIONS FOR TODAY. NEXT AVAILABLE IN  05 HOURS 53 MINUTES 54 SECONDS VISIT HTTPS://MYMEMORY.TRANSLATED.NET/DOC/USAGELIMITS.PHP TO TRANSLATE MORE
bukan tdk mungkin suatu mayat doa pak anies senantiasa sikap baik kpd orang bahkan kpd orang benci,MYMEMORY WARNING: YOU USED ALL AVAILABLE FREE TRANSLATIONS FOR TODAY. NEXT AVAILABLE IN  05 HOURS 53 MINUTES 53 SECONDS VISIT HTTPS://MYMEMORY.TRANSLATED.NET/DOC/USAGELIMITS.PHP TO TRANSLATE MORE
anies tetap pilihankuanies tetap baik baca tafsir alquran srt albaqoroh alloh tutup mata hati org org kafir,MYMEMORY WARNING: YOU USED ALL AVAILABLE FREE TRANSLATIONS FOR TODAY. NEXT AVAILABLE IN  05 HOURS 53 MINUTES 53 SECONDS VISIT HTTPS://MYMEMORY.TRANSLATED.NET/DOC/USAGELIMITS.PHP TO TRANSLATE MORE
wahh bener ka beli fisik nya sii paling neng tuh baca akhir buku pesan anies allah bagi akhir ituu pesan nya pa anies buat didik guru bikin nang,MYMEMORY WARNING: YOU USED ALL AVAILABLE FREE TRANSLATIONS FOR TODAY. NEXT AVAILABLE IN  05 HOURS 53 MINUTES 52 SECONDS VISIT HTTPS://MYMEMORY.TRANSLATED.NET/DOC/USAGELIMITS.PHP TO TRANSLATE MORE
pak anies cuma kalah satu kali lah kalah kali kaga malu,MYMEMORY WARNING: YOU USED ALL AVAILABLE FREE TRANSLATIONS FOR TODAY. NEXT AVAILABLE IN  05 HOURS 53 MINUTES 51 SECONDS VISIT HTTPS://MYMEMORY.TRANSLATED.NET/DOC/USAGELIMITS.PHP TO TRANSLATE MORE
hahaha pak anies phd nyet loe nya apa,MYMEMORY WARNING: YOU USED ALL AVAILABLE FREE TRANSLATIONS FOR TODAY. NEXT AVAILABLE IN  05 HOURS 53 MINUTES 50 SECONDS VISIT HTTPS://MYMEMORY.TRANSLATED.NET/DOC/USAGELIMITS.PHP TO TRANSLATE MORE
guru guru sejak sertifikasi bajing semua,MYMEMORY WARNING: YOU USED ALL AVAILABLE FREE TRANSLATIONS FOR TODAY. NEXT AVAILABLE IN  05 HOURS 53 MINUTES 50 SECONDS VISIT HTTPS://MYMEMORY.TRANSLATED.NET/DOC/USAGELIMITS.PHP TO TRANSLATE MORE
tetep anies baik,MYMEMORY WARNING: YOU USED ALL AVAILABLE FREE TRANSLATIONS FOR TODAY. NEXT AVAILABLE IN  05 HOURS 53 MINUTES 49 SECONDS VISIT HTTPS://MYMEMORY.TRANSLATED.NET/DOC/USAGELIMITS.PHP TO TRANSLATE MORE
pingin ngarang buku judul anies wes edan,MYMEMORY WARNING: YOU USED ALL AVAILABLE FREE TRANSLATIONS FOR TODAY. NEXT AVAILABLE IN  05 HOURS 53 MINUTES 48 SECONDS VISIT HTTPS://MYMEMORY.TRANSLATED.NET/DOC/USAGELIMITS.PHP TO TRANSLATE MORE
woy pak anies ikut welkin,MYMEMORY WARNING: YOU USED ALL AVAILABLE FREE TRANSLATIONS FOR TODAY. NEXT AVAILABLE IN  05 HOURS 53 MINUTES 47 SECONDS VISIT HTTPS://MYMEMORY.TRANSLATED.NET/DOC/USAGELIMITS.PHP TO TRANSLATE MORE
manusia tolol sekal rasain lah biar sadar lu benci anies sama sekali,MYMEMORY WARNING: YOU USED ALL AVAILABLE FREE TRANSLATIONS FOR TODAY. NEXT AVAILABLE IN  05 HOURS 53 MINUTES 47 SECONDS VISIT HTTPS://MYMEMORY.TRANSLATED.NET/DOC/USAGELIMITS.PHP TO TRANSLATE MORE
better harap anies orang mengobrakabrik konstitusi dinasti keluarga,MYMEMORY WARNING: YOU USED ALL AVAILABLE FREE TRANSLATIONS FOR TODAY. NEXT AVAILABLE IN  05 HOURS 53 MINUTES 46 SECONDS VISIT HTTPS://MYMEMORY.TRANSLATED.NET/DOC/USAGELIMITS.PHP TO TRANSLATE MORE
mulut hasto mulut sakit hati,MYMEMORY WARNING: YOU USED ALL AVAILABLE FREE TRANSLATIONS FOR TODAY. NEXT AVAILABLE IN  05 HOURS 53 MINUTES 45 SECONDS VISIT HTTPS://MYMEMORY.TRANSLATED.NET/DOC/USAGELIMITS.PHP TO TRANSLATE MORE
yg benar dungu dukung gila,MYMEMORY WARNING: YOU USED ALL AVAILABLE FREE TRANSLATIONS FOR TODAY. NEXT AVAILABLE IN  05 HOURS 53 MINUTES 44 SECONDS VISIT HTTPS://MYMEMORY.TRANSLATED.NET/DOC/USAGELIMITS.PHP TO TRANSLATE MORE
kawan fens 02 mau traktir gule kambing wkwkwk traktir ngenyek kalah wan anies wkwk,MYMEMORY WARNING: YOU USED ALL AVAILABLE FREE TRANSLATIONS FOR TODAY. NEXT AVAILABLE IN  05 HOURS 53 MINUTES 44 SECONDS VISIT HTTPS://MYMEMORY.TRANSLATED.NET/DOC/USAGELIMITS.PHP TO TRANSLATE MORE
kalo aku tinggal pak anies mau dtg ngga walaupun ak blm ad kontribusi apaapa setidakny aku pernah jadi buzzer gratis,MYMEMORY WARNING: YOU USED ALL AVAILABLE FREE TRANSLATIONS FOR TODAY. NEXT AVAILABLE IN  05 HOURS 53 MINUTES 43 SECONDS VISIT HTTPS://MYMEMORY.TRANSLATED.NET/DOC/USAGELIMITS.PHP TO TRANSLATE MORE
inget pidato anies jadi menang pribumi,MYMEMORY WARNING: YOU USED ALL AVAILABLE FREE TRANSLATIONS FOR TODAY. NEXT AVAILABLE IN  05 HOURS 53 MINUTES 42 SECONDS VISIT HTTPS://MYMEMORY.TRANSLATED.NET/DOC/USAGELIMITS.PHP TO TRANSLATE MORE
coba cek tps milih anies siapa siapa gibran siapa udh jelas v,MYMEMORY WARNING: YOU USED ALL AVAILABLE FREE TRANSLATIONS FOR TODAY. NEXT AVAILABLE IN  05 HOURS 53 MINUTES 41 SECONDS VISIT HTTPS://MYMEMORY.TRANSLATED.NET/DOC/USAGELIMITS.PHP TO TRANSLATE MORE
jadi ikut doa pimpin anies,MYMEMORY WARNING: YOU USED ALL AVAILABLE FREE TRANSLATIONS FOR TODAY. NEXT AVAILABLE IN  05 HOURS 53 MINUTES 41 SECONDS VISIT HTTPS://MYMEMORY.TRANSLATED.NET/DOC/USAGELIMITS.PHP TO TRANSLATE MORE
gasuka sama pak anies wkwkw ketawa gw mahhh,MYMEMORY WARNING: YOU USED ALL AVAILABLE FREE TRANSLATIONS FOR TODAY. NEXT AVAILABLE IN  05 HOURS 53 MINUTES 40 SECONDS VISIT HTTPS://MYMEMORY.TRANSLATED.NET/DOC/USAGELIMITS.PHP TO TRANSLATE MORE
moga jantung baik baik aja anjlok bo ol banyak benci kalo jantung kumat saran minta doa pak anies yaa,MYMEMORY WARNING: YOU USED ALL AVAILABLE FREE TRANSLATIONS FOR TODAY. NEXT AVAILABLE IN  05 HOURS 53 MINUTES 39 SECONDS VISIT HTTPS://MYMEMORY.TRANSLATED.NET/DOC/USAGELIMITS.PHP TO TRANSLATE MORE
nah dukung 02 bikin isu klu pak anies tinggal pks nasdem pkb kan tahu sendiri dukung 02 rata2 mudah dikibulin,MYMEMORY WARNING: YOU USED ALL AVAILABLE FREE TRANSLATIONS FOR TODAY. NEXT AVAILABLE IN  05 HOURS 53 MINUTES 38 SECONDS VISIT HTTPS://MYMEMORY.TRANSLATED.NET/DOC/USAGELIMITS.PHP TO TRANSLATE MORE
bahkan anies nasdem puan pdip nya lebih punya etika ajak gibran jadi wapres putus mk gibran pilih pinang lebih etis putus mk,MYMEMORY WARNING: YOU USED ALL AVAILABLE FREE TRANSLATIONS FOR TODAY. NEXT AVAILABLE IN  05 HOURS 53 MINUTES 38 SECONDS VISIT HTTPS://MYMEMORY.TRANSLATED.NET/DOC/USAGELIMITS.PHP TO TRANSLATE MORE
universitas pertahananinisiatornya diri jendral anies baswedan dar dosen rektor angkat saudara diri,MYMEMORY WARNING: YOU USED ALL AVAILABLE FREE TRANSLATIONS FOR TODAY. NEXT AVAILABLE IN  05 HOURS 53 MINUTES 37 SECONDS VISIT HTTPS://MYMEMORY.TRANSLATED.NET/DOC/USAGELIMITS.PHP TO TRANSLATE MORE
psi kalian benar buah partai apa padu suara buat nynyirin anies baswedan,MYMEMORY WARNING: YOU USED ALL AVAILABLE FREE TRANSLATIONS FOR TODAY. NEXT AVAILABLE IN  05 HOURS 53 MINUTES 36 SECONDS VISIT HTTPS://MYMEMORY.TRANSLATED.NET/DOC/USAGELIMITS.PHP TO TRANSLATE MORE
juru bicara tim nasional menang aniesmuhaimin timnas amin billy david nerotumelina tekan mahkamah konstitusi mk milik wenang unt,MYMEMORY WARNING: YOU USED ALL AVAILABLE FREE TRANSLATIONS FOR TODAY. NEXT AVAILABLE IN  05 HOURS 53 MINUTES 35 SECONDS VISIT HTTPS://MYMEMORY.TRANSLATED.NET/DOC/USAGELIMITS.PHP TO TRANSLATE MORE
moga pak anies dukung fitnah selalu sehat rezeki lancar gapapa gapapa kan tau orangnyang gibah fitnah dapet pahala laku,MYMEMORY WARNING: YOU USED ALL AVAILABLE FREE TRANSLATIONS FOR TODAY. NEXT AVAILABLE IN  05 HOURS 53 MINUTES 35 SECONDS VISIT HTTPS://MYMEMORY.TRANSLATED.NET/DOC/USAGELIMITS.PHP TO TRANSLATE MORE
waaah banyak lupa bahkan rame2 tuntut lupa pertama tarik gibran utk jadi wapres anies nasdem ikut puan pdip tarik gibran utk jadi wapres nya judicial review aku aju pdi tuju mk,MYMEMORY WARNING: YOU USED ALL AVAILABLE FREE TRANSLATIONS FOR TODAY. NEXT AVAILABLE IN  05 HOURS 53 MINUTES 34 SECONDS VISIT HTTPS://MYMEMORY.TRANSLATED.NET/DOC/USAGELIMITS.PHP TO TRANSLATE MORE
info loker parttime part time freelance freelancer ajar mahsiswa kuliah sekolah wfh iphone netflix disney viu joki wts wtb pc konser tiket debat milu capres cawapres amin anies imin pragi gibran mahfud 2k,MYMEMORY WARNING: YOU USED ALL AVAILABLE FREE TRANSLATIONS FOR TODAY. NEXT AVAILABLE IN  05 HOURS 53 MINUTES 33 SECONDS VISIT HTTPS://MYMEMORY.TRANSLATED.NET/DOC/USAGELIMITS.PHP TO TRANSLATE MORE
acara anies kta advokat nya aja kadaluarsa wkwkwkw,MYMEMORY WARNING: YOU USED ALL AVAILABLE FREE TRANSLATIONS FOR TODAY. NEXT AVAILABLE IN  05 HOURS 53 MINUTES 32 SECONDS VISIT HTTPS://MYMEMORY.TRANSLATED.NET/DOC/USAGELIMITS.PHP TO TRANSLATE MORE
curang soal apausia bansos siapa ajuin gugagatan usia mk kalo gibran salah bansos jokowi milu lantas kalo bansos rakyat pilih 02 gitu bukti anies dapet suara jangan latah ah,MYMEMORY WARNING: YOU USED ALL AVAILABLE FREE TRANSLATIONS FOR TODAY. NEXT AVAILABLE IN  05 HOURS 53 MINUTES 32 SECONDS VISIT HTTPS://MYMEMORY.TRANSLATED.NET/DOC/USAGELIMITS.PHP TO TRANSLATE MORE
emamg anies siapapresidenjokowi n hina jg caci maki aja biasaiya bu emang pantas usir bikin pecah negara inivang,MYMEMORY WARNING: YOU USED ALL AVAILABLE FREE TRANSLATIONS FOR TODAY. NEXT AVAILABLE IN  05 HOURS 53 MINUTES 31 SECONDS VISIT HTTPS://MYMEMORY.TRANSLATED.NET/DOC/USAGELIMITS.PHP TO TRANSLATE MORE
anies baswedan turut datang layat rumah duka hilbram dunar kenang sosok hilbram turut aktif libat masa kampanye diri jadi capres tonton lengkap video ikut,MYMEMORY WARNING: YOU USED ALL AVAILABLE FREE TRANSLATIONS FOR TODAY. NEXT AVAILABLE IN  05 HOURS 53 MINUTES 30 SECONDS VISIT HTTPS://MYMEMORY.TRANSLATED.NET/DOC/USAGELIMITS.PHP TO TRANSLATE MORE
harus 17 24 biar kek suara anies wkwkwkwk,MYMEMORY WARNING: YOU USED ALL AVAILABLE FREE TRANSLATIONS FOR TODAY. NEXT AVAILABLE IN  05 HOURS 53 MINUTES 29 SECONDS VISIT HTTPS://MYMEMORY.TRANSLATED.NET/DOC/USAGELIMITS.PHP TO TRANSLATE MORE
aura sholeh amp solehah artis circle pak anies baswedan mbak bukan dewi,MYMEMORY WARNING: YOU USED ALL AVAILABLE FREE TRANSLATIONS FOR TODAY. NEXT AVAILABLE IN  05 HOURS 53 MINUTES 29 SECONDS VISIT HTTPS://MYMEMORY.TRANSLATED.NET/DOC/USAGELIMITS.PHP TO TRANSLATE MORE
jejak digital bro tp hebat pak anies krn fakta kalah,MYMEMORY WARNING: YOU USED ALL AVAILABLE FREE TRANSLATIONS FOR TODAY. NEXT AVAILABLE IN  05 HOURS 53 MINUTES 28 SECONDS VISIT HTTPS://MYMEMORY.TRANSLATED.NET/DOC/USAGELIMITS.PHP TO TRANSLATE MORE
nyinyir lo anies baswedan gk sanggup antar lo parlemen ikut partai lo rakyat cerdas rakyat butuh inovasi bukan jual bacot julitan ajar ajar buat semua caleg,MYMEMORY WARNING: YOU USED ALL AVAILABLE FREE TRANSLATIONS FOR TODAY. NEXT AVAILABLE IN  05 HOURS 53 MINUTES 27 SECONDS VISIT HTTPS://MYMEMORY.TRANSLATED.NET/DOC/USAGELIMITS.PHP TO TRANSLATE MORE
alhamdulillah barakallahu fiik pak anies ini jawab doa orang zalim,MYMEMORY WARNING: YOU USED ALL AVAILABLE FREE TRANSLATIONS FOR TODAY. NEXT AVAILABLE IN  05 HOURS 53 MINUTES 26 SECONDS VISIT HTTPS://MYMEMORY.TRANSLATED.NET/DOC/USAGELIMITS.PHP TO TRANSLATE MORE
tempo partai dukung anies amp tak solid dorong hak angket curang milu dpr giur imingiming kursi menteri,MYMEMORY WARNING: YOU USED ALL AVAILABLE FREE TRANSLATIONS FOR TODAY. NEXT AVAILABLE IN  05 HOURS 53 MINUTES 26 SECONDS VISIT HTTPS://MYMEMORY.TRANSLATED.NET/DOC/USAGELIMITS.PHP TO TRANSLATE MORE
id samar krn lihat pinternya apa hubung anies dgn harvey moeis,MYMEMORY WARNING: YOU USED ALL AVAILABLE FREE TRANSLATIONS FOR TODAY. NEXT AVAILABLE IN  05 HOURS 53 MINUTES 25 SECONDS VISIT HTTPS://MYMEMORY.TRANSLATED.NET/DOC/USAGELIMITS.PHP TO TRANSLATE MORE
pak anies niat nyagub mana nama mendowngrade diri sendiri jangan kawatir pak anies banyak butuh yakin jatuh pak anies sungguh aku kalau pak anies lebih tinggi posisi,MYMEMORY WARNING: YOU USED ALL AVAILABLE FREE TRANSLATIONS FOR TODAY. NEXT AVAILABLE IN  05 HOURS 53 MINUTES 24 SECONDS VISIT HTTPS://MYMEMORY.TRANSLATED.NET/DOC/USAGELIMITS.PHP TO TRANSLATE MORE
suka main x tp kok pinter2 apa hubung anies dgn harvey moeis,MYMEMORY WARNING: YOU USED ALL AVAILABLE FREE TRANSLATIONS FOR TODAY. NEXT AVAILABLE IN  05 HOURS 53 MINUTES 23 SECONDS VISIT HTTPS://MYMEMORY.TRANSLATED.NET/DOC/USAGELIMITS.PHP TO TRANSLATE MORE
mas anies salah,MYMEMORY WARNING: YOU USED ALL AVAILABLE FREE TRANSLATIONS FOR TODAY. NEXT AVAILABLE IN  05 HOURS 53 MINUTES 23 SECONDS VISIT HTTPS://MYMEMORY.TRANSLATED.NET/DOC/USAGELIMITS.PHP TO TRANSLATE MORE
ujung2 nya si genduk ngaku dokter cuma giring opini bilang bhw anies no 1 nduk nduk jelas kompetensi mu apa ahli provokasi,MYMEMORY WARNING: YOU USED ALL AVAILABLE FREE TRANSLATIONS FOR TODAY. NEXT AVAILABLE IN  05 HOURS 53 MINUTES 22 SECONDS VISIT HTTPS://MYMEMORY.TRANSLATED.NET/DOC/USAGELIMITS.PHP TO TRANSLATE MORE
anies suka laporlapor nangkep orang bebas dapat fakta jawab fitnah benci,MYMEMORY WARNING: YOU USED ALL AVAILABLE FREE TRANSLATIONS FOR TODAY. NEXT AVAILABLE IN  05 HOURS 53 MINUTES 21 SECONDS VISIT HTTPS://MYMEMORY.TRANSLATED.NET/DOC/USAGELIMITS.PHP TO TRANSLATE MORE
bukti skrng terungkapmemangnya skrng presiden siapaanies,MYMEMORY WARNING: YOU USED ALL AVAILABLE FREE TRANSLATIONS FOR TODAY. NEXT AVAILABLE IN  05 HOURS 53 MINUTES 20 SECONDS VISIT HTTPS://MYMEMORY.TRANSLATED.NET/DOC/USAGELIMITS.PHP TO TRANSLATE MORE
gk ngerti klo status praroro amp pak anies sama cb tarik nazab nya atas semua turun dr org luar china amp arab datang mn,MYMEMORY WARNING: YOU USED ALL AVAILABLE FREE TRANSLATIONS FOR TODAY. NEXT AVAILABLE IN  05 HOURS 53 MINUTES 20 SECONDS VISIT HTTPS://MYMEMORY.TRANSLATED.NET/DOC/USAGELIMITS.PHP TO TRANSLATE MORE
mas anies mas anies suara pak gemoy,MYMEMORY WARNING: YOU USED ALL AVAILABLE FREE TRANSLATIONS FOR TODAY. NEXT AVAILABLE IN  05 HOURS 53 MINUTES 19 SECONDS VISIT HTTPS://MYMEMORY.TRANSLATED.NET/DOC/USAGELIMITS.PHP TO TRANSLATE MORE
level kali hahahahaha,MYMEMORY WARNING: YOU USED ALL AVAILABLE FREE TRANSLATIONS FOR TODAY. NEXT AVAILABLE IN  05 HOURS 53 MINUTES 18 SECONDS VISIT HTTPS://MYMEMORY.TRANSLATED.NET/DOC/USAGELIMITS.PHP TO TRANSLATE MORE
aja ni anak abah sakit hati 5 tahun buru main presiden presiden rumah anies aja dah mending,MYMEMORY WARNING: YOU USED ALL AVAILABLE FREE TRANSLATIONS FOR TODAY. NEXT AVAILABLE IN  05 HOURS 53 MINUTES 17 SECONDS VISIT HTTPS://MYMEMORY.TRANSLATED.NET/DOC/USAGELIMITS.PHP TO TRANSLATE MORE
buzer2 02 gencar serang pak anies kejar target paling disautin sama buzer 02,MYMEMORY WARNING: YOU USED ALL AVAILABLE FREE TRANSLATIONS FOR TODAY. NEXT AVAILABLE IN  05 HOURS 53 MINUTES 17 SECONDS VISIT HTTPS://MYMEMORY.TRANSLATED.NET/DOC/USAGELIMITS.PHP TO TRANSLATE MORE
apa tdk suka dr pak anies hingga jadi orang buta hati jahat jahat jahat iri dengki jg masuk dalam diri,MYMEMORY WARNING: YOU USED ALL AVAILABLE FREE TRANSLATIONS FOR TODAY. NEXT AVAILABLE IN  05 HOURS 53 MINUTES 16 SECONDS VISIT HTTPS://MYMEMORY.TRANSLATED.NET/DOC/USAGELIMITS.PHP TO TRANSLATE MORE
mas anies gimana nih kerja ngapain sih mas anies,MYMEMORY WARNING: YOU USED ALL AVAILABLE FREE TRANSLATIONS FOR TODAY. NEXT AVAILABLE IN  05 HOURS 53 MINUTES 15 SECONDS VISIT HTTPS://MYMEMORY.TRANSLATED.NET/DOC/USAGELIMITS.PHP TO TRANSLATE MORE
akun pak anies coba,MYMEMORY WARNING: YOU USED ALL AVAILABLE FREE TRANSLATIONS FOR TODAY. NEXT AVAILABLE IN  05 HOURS 53 MINUTES 14 SECONDS VISIT HTTPS://MYMEMORY.TRANSLATED.NET/DOC/USAGELIMITS.PHP TO TRANSLATE MORE
dikitdikit anies,MYMEMORY WARNING: YOU USED ALL AVAILABLE FREE TRANSLATIONS FOR TODAY. NEXT AVAILABLE IN  05 HOURS 53 MINUTES 14 SECONDS VISIT HTTPS://MYMEMORY.TRANSLATED.NET/DOC/USAGELIMITS.PHP TO TRANSLATE MORE
aw malu banget mending share prestasi junjung kalian sih nyebar hoax begini no anies no life,MYMEMORY WARNING: YOU USED ALL AVAILABLE FREE TRANSLATIONS FOR TODAY. NEXT AVAILABLE IN  05 HOURS 53 MINUTES 13 SECONDS VISIT HTTPS://MYMEMORY.TRANSLATED.NET/DOC/USAGELIMITS.PHP TO TRANSLATE MORE
mulai deh alias dulu bukan anies b pernah jadi menteri yahhhhh bukan menristekdikti sih but still,MYMEMORY WARNING: YOU USED ALL AVAILABLE FREE TRANSLATIONS FOR TODAY. NEXT AVAILABLE IN  05 HOURS 53 MINUTES 12 SECONDS VISIT HTTPS://MYMEMORY.TRANSLATED.NET/DOC/USAGELIMITS.PHP TO TRANSLATE MORE
jangan gitu bang hibur diri tuh si anies kalah,MYMEMORY WARNING: YOU USED ALL AVAILABLE FREE TRANSLATIONS FOR TODAY. NEXT AVAILABLE IN  05 HOURS 53 MINUTES 11 SECONDS VISIT HTTPS://MYMEMORY.TRANSLATED.NET/DOC/USAGELIMITS.PHP TO TRANSLATE MORE
lah anies lu anggap apa gaada pegang aja mau dukung,MYMEMORY WARNING: YOU USED ALL AVAILABLE FREE TRANSLATIONS FOR TODAY. NEXT AVAILABLE IN  05 HOURS 53 MINUTES 11 SECONDS VISIT HTTPS://MYMEMORY.TRANSLATED.NET/DOC/USAGELIMITS.PHP TO TRANSLATE MORE
gue kagak percaya mulutnye anies soal angin kaga punya ktp jdi admin bt status kaga punya ktp,MYMEMORY WARNING: YOU USED ALL AVAILABLE FREE TRANSLATIONS FOR TODAY. NEXT AVAILABLE IN  05 HOURS 53 MINUTES 10 SECONDS VISIT HTTPS://MYMEMORY.TRANSLATED.NET/DOC/USAGELIMITS.PHP TO TRANSLATE MORE
dukung 02 mas anies nasib sama,MYMEMORY WARNING: YOU USED ALL AVAILABLE FREE TRANSLATIONS FOR TODAY. NEXT AVAILABLE IN  05 HOURS 53 MINUTES 09 SECONDS VISIT HTTPS://MYMEMORY.TRANSLATED.NET/DOC/USAGELIMITS.PHP TO TRANSLATE MORE
kaya suka 25 orang indonesia sisa benci jadi acu kalau pribadi anies buruk mata masyarakat indonesia,MYMEMORY WARNING: YOU USED ALL AVAILABLE FREE TRANSLATIONS FOR TODAY. NEXT AVAILABLE IN  05 HOURS 53 MINUTES 08 SECONDS VISIT HTTPS://MYMEMORY.TRANSLATED.NET/DOC/USAGELIMITS.PHP TO TRANSLATE MORE
loh bukan salah pak anies,MYMEMORY WARNING: YOU USED ALL AVAILABLE FREE TRANSLATIONS FOR TODAY. NEXT AVAILABLE IN  05 HOURS 53 MINUTES 08 SECONDS VISIT HTTPS://MYMEMORY.TRANSLATED.NET/DOC/USAGELIMITS.PHP TO TRANSLATE MORE
sammmaa jgn sakit hati rakyat ingin anies jadi presiden dgn curang tsm jgn bodoh rakyat pak bapak memang mau jadi bagi hancur demokrasi indonesia bapak sdh cukup baik bersih jgn kotor pak anak,MYMEMORY WARNING: YOU USED ALL AVAILABLE FREE TRANSLATIONS FOR TODAY. NEXT AVAILABLE IN  05 HOURS 53 MINUTES 07 SECONDS VISIT HTTPS://MYMEMORY.TRANSLATED.NET/DOC/USAGELIMITS.PHP TO TRANSLATE MORE
puja anies sakit semua,MYMEMORY WARNING: YOU USED ALL AVAILABLE FREE TRANSLATIONS FOR TODAY. NEXT AVAILABLE IN  05 HOURS 53 MINUTES 06 SECONDS VISIT HTTPS://MYMEMORY.TRANSLATED.NET/DOC/USAGELIMITS.PHP TO TRANSLATE MORE
mas anies selalu bawa,MYMEMORY WARNING: YOU USED ALL AVAILABLE FREE TRANSLATIONS FOR TODAY. NEXT AVAILABLE IN  05 HOURS 53 MINUTES 05 SECONDS VISIT HTTPS://MYMEMORY.TRANSLATED.NET/DOC/USAGELIMITS.PHP TO TRANSLATE MORE
jelas dong min anies pantes2nya satu suruh ngamen tiktok satu daftar jadi artis bokep aja,MYMEMORY WARNING: YOU USED ALL AVAILABLE FREE TRANSLATIONS FOR TODAY. NEXT AVAILABLE IN  05 HOURS 53 MINUTES 05 SECONDS VISIT HTTPS://MYMEMORY.TRANSLATED.NET/DOC/USAGELIMITS.PHP TO TRANSLATE MORE
kata ustadz goblokhahahahaha 271 t rugi ekonomi negara akibat ulah sangka bukan jumlah uang makan sangka,MYMEMORY WARNING: YOU USED ALL AVAILABLE FREE TRANSLATIONS FOR TODAY. NEXT AVAILABLE IN  05 HOURS 53 MINUTES 04 SECONDS VISIT HTTPS://MYMEMORY.TRANSLATED.NET/DOC/USAGELIMITS.PHP TO TRANSLATE MORE
tolol jgn banyak cocot bedebah anies si rambut putih kyknya nih orang,MYMEMORY WARNING: YOU USED ALL AVAILABLE FREE TRANSLATIONS FOR TODAY. NEXT AVAILABLE IN  05 HOURS 53 MINUTES 03 SECONDS VISIT HTTPS://MYMEMORY.TRANSLATED.NET/DOC/USAGELIMITS.PHP TO TRANSLATE MORE
masalah lu harap sama anies ganjar,MYMEMORY WARNING: YOU USED ALL AVAILABLE FREE TRANSLATIONS FOR TODAY. NEXT AVAILABLE IN  05 HOURS 53 MINUTES 02 SECONDS VISIT HTTPS://MYMEMORY.TRANSLATED.NET/DOC/USAGELIMITS.PHP TO TRANSLATE MORE
namain anies imin mahfud ganjar,MYMEMORY WARNING: YOU USED ALL AVAILABLE FREE TRANSLATIONS FOR TODAY. NEXT AVAILABLE IN  05 HOURS 53 MINUTES 02 SECONDS VISIT HTTPS://MYMEMORY.TRANSLATED.NET/DOC/USAGELIMITS.PHP TO TRANSLATE MORE
sdh buat curang kalahhahahaha,MYMEMORY WARNING: YOU USED ALL AVAILABLE FREE TRANSLATIONS FOR TODAY. NEXT AVAILABLE IN  05 HOURS 53 MINUTES 01 SECONDS VISIT HTTPS://MYMEMORY.TRANSLATED.NET/DOC/USAGELIMITS.PHP TO TRANSLATE MORE
bentar css masuk jajar salah terus sabar css mungkin kamu guru sama pak anies,MYMEMORY WARNING: YOU USED ALL AVAILABLE FREE TRANSLATIONS FOR TODAY. NEXT AVAILABLE IN  05 HOURS 53 MINUTES 00 SECONDS VISIT HTTPS://MYMEMORY.TRANSLATED.NET/DOC/USAGELIMITS.PHP TO TRANSLATE MORE
moga anies pimpin doa buat mati,MYMEMORY WARNING: YOU USED ALL AVAILABLE FREE TRANSLATIONS FOR TODAY. NEXT AVAILABLE IN  05 HOURS 52 MINUTES 59 SECONDS VISIT HTTPS://MYMEMORY.TRANSLATED.NET/DOC/USAGELIMITS.PHP TO TRANSLATE MORE
duh kasihan dukung capres cundang otak konslet,MYMEMORY WARNING: YOU USED ALL AVAILABLE FREE TRANSLATIONS FOR TODAY. NEXT AVAILABLE IN  05 HOURS 52 MINUTES 59 SECONDS VISIT HTTPS://MYMEMORY.TRANSLATED.NET/DOC/USAGELIMITS.PHP TO TRANSLATE MORE
salah anies kak,MYMEMORY WARNING: YOU USED ALL AVAILABLE FREE TRANSLATIONS FOR TODAY. NEXT AVAILABLE IN  05 HOURS 52 MINUTES 58 SECONDS VISIT HTTPS://MYMEMORY.TRANSLATED.NET/DOC/USAGELIMITS.PHP TO TRANSLATE MORE
salah ttp pak anies,MYMEMORY WARNING: YOU USED ALL AVAILABLE FREE TRANSLATIONS FOR TODAY. NEXT AVAILABLE IN  05 HOURS 52 MINUTES 57 SECONDS VISIT HTTPS://MYMEMORY.TRANSLATED.NET/DOC/USAGELIMITS.PHP TO TRANSLATE MORE
ussh mimpi lah memang aku anies orang baik baik cukup,MYMEMORY WARNING: YOU USED ALL AVAILABLE FREE TRANSLATIONS FOR TODAY. NEXT AVAILABLE IN  05 HOURS 52 MINUTES 56 SECONDS VISIT HTTPS://MYMEMORY.TRANSLATED.NET/DOC/USAGELIMITS.PHP TO TRANSLATE MORE
gwangil kurang cium tangan jadi anies baswedan,MYMEMORY WARNING: YOU USED ALL AVAILABLE FREE TRANSLATIONS FOR TODAY. NEXT AVAILABLE IN  05 HOURS 52 MINUTES 56 SECONDS VISIT HTTPS://MYMEMORY.TRANSLATED.NET/DOC/USAGELIMITS.PHP TO TRANSLATE MORE
