full_text,tweet_english
kayak suka kalo mati didoain anies mau dijogetin pragib,kayak sukao mati dioain anies mau dijogetin pragib
dulu sangat kagum sama pak todung mulya kali muak lihat akibat tuntut mk jelas2 kala telak anies mau bantu suara lebih paruh baru mau usul pilih ulang pikir aja daerah kala bayang,used to be very impressed with Mr. Todung Mulya when he was fed up with seeing the consequences of demanding mk clearly at the time of the collapse of anies wanted to help the voice be more halfway new to the proposal to re-elect just think about the region when the shadow
track recordnya mirip pak anies punya gera ubah manfaat background ilmu jg moga amanah,the track record is similar to pak anies has gera change the benefits of background science jg moga amanah
badrun mungkin cuan gerombol anies,badrun may cuan horde anies
raut wajah kok lebih tua,the look on her face is older
tiga capres pak anies janji rampas aset koruptor miskin bagaimana kakak pak anies baswedan layak jadi pimpin negeri periode 20242029,"three presidential candidates, Mr. Anies promised to seize the assets of poor corruptors, how Mr. Anies Baswedan is fit to be the leader of the state for the period 20242029"
anies benah,benah anies
buzzer tolol nih mana biasa anies masuk ranah timah bukan kuasa rakyat biasayg biasa masuk orang2 penguasakwkwkwk goblok pake otak,"stupid buzzer where the usual anies enter the realm of tin is not the power of the people, it is normal to enter the people who are the masters ofkwkwk idiots with brains"
anies jabat thn brp amp warga mulai tempat area sensitive mulai kpn,anies jabat yn brp & residents start where sensitive areas start kpn
amat sebut anies jangan ikut pilkada dki 2024 muncul persepsi cari untung,extremely mention anies don't participate in the 2024 dki election the perception of profit making appears
hari sidang sengketa pilpres gelar agenda periksa saksi ahli aniesmuhaimin,the day of the election dispute hearing the title of the agenda check expert witnesses aniesmuhaimin
pov anies baswedan jadi presiden,pov anies baswedan became president
iya si babu kasar ngomong anjing abah anies padahal sendiri anjing,yes the babu rude talking dog abah anies even though he himself is a dog
doktri ubah usung si dungu bual tukang bacot nyata sangat ampuh mujarab org waras stlh jadi dukung anies otak langsung ubah jadi gila,doctri change the fool's pouch talk bacot real very potent efficacious sane people stlh so support anies brain instantly turn into crazy
gabisa move on banget sama anies baswedan sih pak udah menang tu junjunannya balik fb sana hus hus,gabisa move on really the same anies baswedan sih sir already won the junjunannya back fb there hus hus
apa kerja ni kuntilanak hujat anies,what is this job kuntilanak blasphemy anies
jokowi kasih ktp anies kasih imb,jokowi kasih ktp anies kasih imb
lho mas lu blm keluar rsj,you know mas you blm out rsj
kirain lu sdh keluar rumah sakit jiwa mas,kirain lu sdh out of the mental hospital mas
anies cerdas amanah percaya,anies intelligent trust trust
kpu andai aniesmuhaimin menang apa soal calon gibran,kpu if aniesmuhaimin wins what about gibran candidates
kan si aderais cm bilang moga pak anies pimpin doa bwt kamu pikir doa jelek kan macam2 doa pak anies jg pasti ngedoain baik bwt bapak kamu bilang aja terima kasih moga doa baik kabul,the aderais cm said moga pak anies pimpin doa bwt you think prayer is bad right kinds of prayer pak anies jg definitely ngedoain baik bwt your father said aja thank you moga doa baik kabul
aku bukan dukung anies kasus harvey kan buat alih isu akibat bansos buat sang anak presiden besar 500t logika aja 271t main jabat dalam mana mungkin yeuuu wkwkwk,"i do not support anies harvey case, right, to change the issue due to bansos for the son of the great president 500t logic just 271t playing jabat in where possible yeuuu wkwkwk"
monggo beri klarifikasi benar,monggo gave the right clarification
sebenernya semua caleg bawah nasdem dukung pak anies soal i know one people orang dosen perempuan meni meni usia 30 tahun kemaren nyaleg bawah nasdem garis keras ujar benci pak anies,actually all candidates under nasdem support pak anies about i know one people people lecturer women meni meni age 30 years ago nyaleg under nasdem hard line say hate pak anies
sidang sengketa pilpres gelar senin mk kali kubu aniesmuhaimin hadir saksi ahli dengar terang,election dispute hearing Monday mk time aniesmuhaimin camp present witness expert hearing
rawan gibran tangkap korupsi,prone to gibran catching corruption
lha masuk akal sihpengerahan dukung aniesemang anies punya kuasa apa wkwkwkwk,lha makes sense sihpahan support aniesemang anies have power what wkwkwkwk
emang dukung anies tolol semua,eang support stupid anies all
jangan kaget suatu hari tenang ikn tiba tiba pak anies terbang pake jubah item mata warna ungu terus reak reak itami o kanjiro itami o kangaero itami o uketore itami o shire koko yori seka ni itami o shinra tensei,do not be surprised one day calm ikn suddenly sir anies fly wear robes purple eye items continue to reak reak itami o kanjiro itami o kangaero itami o uketore itami o shire koko yori seka ni itami o shinra tensei
hallo bagaimana ugm,hello how is ugm
hijab dehilma udah topi semua tp harga ny emg doa in emak biar beli kpu anies sahur sidang mk trilyun moeis harvey gempa aghnia paloh psikopat dajjal singgih bmkg gaza israel puasa,hijab dehilma already hat all tp price ny emg prayer in mom let buy kpu anies sahur trial mk trillion moeis harvey earthquake aghnia paloh psychopath dajjal singgih bmkg gaza israel fast
rakyat tenang kok km aja ribut sendiri pak anies g bikin ribut kalian kok makanya loh introspeksi diri salah jadi bingung sendiri kan,"the people are calm, how can they just make a fuss about themselves, Mr. Anies, how can they make a fuss about you, so that's why the self-introspection is wrong, so it's confusing, right?"
dateng ntar anies,dateng ntar anies
tiap liat orang2 ngedukung pak anies wajah adem2 tenang santun jadi neng pernah bosen bangga baris sama abah,"every look of people supporting Mr. Anies, the face of Adem2 is calm, polite, so Neng has never been a proud lecturer in the same line as Abah"
requirement villain arcnya pak anies udah fulfilled nih,requirements villain arcnya pak anies already fulfilled here
orang bawa kereta nama apa mas anies,people bring a car what's the name mas anies
selangkang merah merah salah anies,red red crotch wrong anies
orang lanjut doa pak anies,people continue the prayer pack anies
masasih kerah dukung anies antero dunia ngga temu orang,masasih kerar support anies antero the world does not meet people
memang anies tahu malu,indeed shameless anies
sengketa pilpres mk hari periksa saksi ahli kubu aniesmuhaimin,presidential election dispute mk day check expert witness fort aniesmuhaimin
amin moga kabul ken banget doa in pak anies,amen moga kabul ken really prayer in pak anies
dukung fanatik anies jg banyak kok,support anies fanatics too much
hari hakim mk dengar bukti saksi ahli kubu aniesmuhaimin ganjarmahfud,the day the judge mk heard the evidence of expert witnesses aniesmuhaimin fort ganjarmahfud
ayo cari main baru buat lolos senayan 2029 bukti nebeng nama besar pak anies gagal,let's find a new game to get through senayan 2029 evidence of nebeng big name pak anies fail
kirim salam buat babeh kmren babeh nya dukung pak anies ga,send greetings to babeh kmren babehnya support pak anies ga
hrg orang anies ngeluarin cuan ratus ribu trilyun pakanieskeren,hrg anies people chasing cuan hundred thousand trillion pakanieskeren
hari hakim mk dengar bukti saksi ahli kubu aniesmuhaimin ganjarmahfud,the day the judge mk heard the evidence of expert witnesses aniesmuhaimin fort ganjarmahfud
kasi aa kasi semangat mr plesiden anies kata rakyat 24,kasi aa kasi spirit mr plesiden anies perkataan rakyat 24
rakyat 58 sdh aku dunia as china perancis bbrp negara sdh ucap selamat kasi ee kasi anies ngotot mk,people 58 SDH I am the world as china france bbrp country SDH congratulate kasi ee kasi anies insist mk
mr halu anies the plesiden kata rakyat 24,mr halu anies the plesiden said the people 24
ikut yesus taat harus semua org aku agama nasrani protestan katolik salib beneran sama persis alami yesus hari paskah bukan raya seremonial angkat yesus jadi tuhan sbg objek tonton siksa,following jesus obedience must be all people i am a Christian Protestant Catholic religion the cross is really the exact same natural jesus easter day is not a ceremonial feast lift jesus so god as an object of torment watch
anies baik,good anies
pemiludemokrasi dlm islam haram jadi wajar lah klo laku demokrasi laku tindak curang hal judi haram islam laku tindak curang,the election of democracy in Islam is illegal so it is only natural that the practice of democracy is cheating in the case of illegal gambling in Islam.
momen orang tinggal tetep aja pikir anies baswedan kata gw kalo udah sampe obat dokter jantung mending cepet cepet tobat dah,the moment people stay still just think anies baswedan said gw if you've arrived at the heart doctor's medicine mending fast fast to repent already
bjir tumben ino krisis gin duh nerbener salah anies,bjir tumben ino gin crisis duh nerbener wrong anies
biarin aja siapa suruh oon lagi uang apbd bukan duit anies,biarin just who told oon more money apbd not anies money
adil benar bukankah hrsnya beri lindung saksi ahli 2 ahli kubu anies batal beri terang mk sebut khawatir konsekwensi,fair is right shouldn't it protect expert witnesses 2 experts anies camp cancel give light mk say worry about consequences
betuuuul 2024 anies kalah,betuuul 2024 anies lost
seperti emang 02 kerah fitnah anies baswedan team lihat akun buzzer rp 02 enak banget fitnah sana sini dukung bodoh langsung percaya emang benar benar parah bodoh,like 02 collar slander anies baswedan team see the buzzer account rp 02 really good slander here and there support stupid immediately believe it's really bad stupid
kasi nih org sakit hati akut bener samapak anies km apa2nya ama beliau,kasi nih orang sakit hati acute bener samapak anies km apa2 ama dia
arti masuk kelompok kurang paham apa kata ketua sidang mk ngga hadir hari mohon 02 alias pihak soal ganti hari hadir saksi mohon 01 alias pihak anies besok baru saksi kl kait tetap hadir,the meaning of entering the group does not understand what the chairman of the hearing said mk not to be present on the day of the request 02 aka the party about changing the day of the witness to be present 01 aka the anies party tomorrow only the kl hook witness remains present
waras memang identik ketaqwaan rasa takut tuhandan hasil dik orang tua tanam sejak keciljuga hidayah allahsangat mahal manusia baik laku itubuat abah anies timsemoga allah kuat,"sane is indeed identical to fear fear of God and the results of being planted by parents since childhood, also guidance of God is very expensive human beings are good at doing it prophecy anies tims hope God is strong"
coba ktnya ad ulama dukung anies ksih bukti dong klo bnrrn ad klo emng ad brrti ulama mau nyari duniawi bkn surgawi,try it ad ulama support anies ksih evidence dong klo bnrrn ad klo emng ad brrti ulama want to see earthly bkn heavenly
2014 kalah 2019 kalah 2024 anies baswedan kalah,2014 lost 2019 lost 2024 anies baswedan lost
selamat ulang tahun anies baswey,happy birthday anies baswey
we doomed udh tahap boikot anies mau nya apasih human mudah malah nyari sulit cm krn lo gasuka anies apa dah,we doomed udh boycott stage anies want it apasih human easy even nyari difficult cm because lo gasuka anies apa dah
bayar tanya apa ternak bayar buzzer meski anies kalah 1 adu domba antar pilih 2 biar dukung anies fokus sidang mk,pay ask what cattle pay buzzers even though anies loses 1 sheep fight between select 2 so support anies focus on the mk trial
lebih sampah siapa korupsi siapa salah anies orang2nya emang gila kalian dukung 02,more trash who is corrupt who is wrong anies the people are crazy you support 02
bulan puasa buzzer 02 ttp konsisten ngefitnah pak anies allah moga dukung 02 suka nebar2 fitnah cepet kirim azab sm allah deh biar cepet tobat,the month of fasting buzzer 02 ttp consistent ngefitnah pak anies allah moga support 02 suka nebar2 fitnah cepet send doom sm allah deh agar cepet repent
dulu megawati pernah jadi cawapresnya anies pernah jadi gubernur culik baik hati amp tdk sombong kalahbangkit akhir allah kabul ingin beliau jadi presiden republik indonesiatakbiiiiir,megawati used to be vice president anies used to be governor kidnapped kind & not arrogant defeated risen the end of allah kabul wanted him to be president of the republic of indonesiatakbiiiiir
gugat mk massif bener buzzer belah jelekin anies,lawsuit mk massif bener buzzer segekin anies
to dasar caci nasdem tim anies maling timah pandai kali mulut kalian silat lidah level pendekar,to basic caci nasdem tim anies tin thief clever times your mouth silat tongue warrior level
ooooo kl gambar gerobak truck selalu jadi bahan lawa beda doong ama anies amp jaga martabat bangsa amp warga negara republik indonesialainnya biar dikatain cm 16 kualitas bicara gw bagi 26,ooooo kl picture cart truck always be material lawa different doong ama anies & maintain the dignity of the nation & citizens of the republic of Indonesia other than that let it be said cm 16 quality of speech gw for 26
apa 2 org bukan viral usir anies si blokok,what 2 people are not viral expel anies the blokok
prabowo minta prtggungjawaban gubernur anies soal polusi pngadaan tmpat ibadah jawab semua gk baper dodoooo dodo,prabowo asked for the governor's responsibility anies about pollution pngadaan tmpat worship answer all gk baper dodoooo dodo
maap tp justru ciri ciri sdm rendah org org pola pikir belakang ngedepanin emosi gasuka sama abah kaya gitu mana org pikir maju malah baperan gamau make transport umum gegara dicetusin pak anies jelas gamau rugi bayar pajak lah,maap but precisely the characteristics of low tdm people rear mindset ngedepan gasuka emotions same abah kaya gitu where people think advanced even baperan gamau make public transport gegara triggered pak anies clearly gamau loss pay taxes lah
dzinnun bangun saur ayah siapa menang pilpres 2024 me anies mungkin begini kalo maksud mas,dzinnun wake up saur dad who won the 2024 presidential election me anies maybe like this if you mean mas
beda kelas beda koloni baik sama orang2 baik peak bareng sama peak ngerti kan lo kalau lalat suka kotor,different classes different colonies good with good people peak together with peak understand you if flies like dirty
gak terima kalah karna ngajuin hak angket kahh kak yuk lihat dulu yuk berapa kali junjung ngajuin gugat jgn buat opini seolah2 lama pilpres jadi indo baru pak anies ngajuin gugat,don't accept losing because of driving the right of questionnaire kahh kak let's see first how many times juju ngajuin gugat don't make opinions as if for a long time the presidential election became a new indo pak anies ngajuin gugat
gila buzzerp2 jaman sekarang korupsi siapa salah tetep anies orang2nya bener apa kata dahlan iskan sekarang bangun persepsi lebih giat bangun fakta fakta bosan persepsi lebih tarik terang,crazy buzzerp2 nowadays corruption who is wrong but the people really say dahlan iskan now wake up perception more active wake up fact fact bored perception more attractive
sama kyk diri sendiri anies baswedan gitu,with kyk yourself anies baswedan like that
mau apa bro dukung pranowo anies baswedan siap full nyali ngadepi,what do you want bro support pranowo anies baswedan ready full guts ngadepi
anak lu mauati soal kek anies,your son mauati about anies cake
kalau orang kentut ngoceh duluan nuduh sana nuduh sini eh tau bau busuk pantat sendiri bahkan mulut nya sendiri senjata makan tuan alah si dukung gemoy arab jelek2angiliran haji umrah ftonya arab bejibun banyak salam akal sehat,"if people fart ngoceh first accuse there, eh, you know the stench of their own ass, even their own mouth, the weapon eats, sir, they support the ugly Arabian gemoy, the pilgrimage of Umrah, Ftonya Arabic, bejibun, many greetings of common sense"
gimana cerita si lonte helena nyepongin ndut harvey dukung 01 si cina takut milih anies titis imam mahdi,how is the story of the lonte helena nyepongin ndut harvey support 01 the chinese are afraid to choose anies drops imam mahdi
yg salah anies,wrong anies
sama ajasi twitter kena mulu cuman beda kolam aja semua kena kok anies doang,"together with the help of twitter, you have to start just different pools, everyone has to have anies doang"
10 saksi aniesmuhaimin sengketa pilpres mundur intimidasi,10 witnesses aniesmuhaimin dispute presidential election backs intimidation
lu budeg tolol kamu nonton debat kemarin bagaimana anies kritik si anak asam sulfat atas pencalonanya,lu budeg moron you watched the debate yesterday how anies criticized the son of sulfuric acid for his candidacy
gausa denial semua sama anies twiter kenceng bngt,gausa denial all the same anies twiter kenceng bngt
wkwkwk terima fakta kasi puasa keti kotor bela anies kek bela nabi,wkwkwk accept facts kasi puasa keti kotor bela anies kek bela nabi
anies makan omong sendiri makanya kalah coba kalo ngejelekin menhan 2 putar pilpres,anies eats his own talk so he loses his try if he chokes menhan 2 rotate the presidential election
apa tuntut anies sprt otak kau saran sayacoba ulas ssuatu kau pakai otak cerdas bnyak2 lihat benar ulas benar coba mulai hobby baru baca buku cerdas indah jadi dungu larang paham coy,what demands anies sprt brain you suggest me try review ssuatu you use a smart brain bnyak2 see really review really try to start a new hobby read a beautiful smart book so stupid forbid understand coy
gapake mah bukan pak anies jg rugi tp sendiri rugi bayar pajak tp guna fasilitas publik,gapake mah not pak anies jg loss but own loss to pay taxes but use public facilities
terus gw suruh percaya anies hobi khianat,then I told you to believe anies betrayed hobby
lho kalo anies boong puasa batal,you know if anies boong fast cancel
sidang sengketa pilpres 2024 kpu sebut mohon aniesmuhaimin kabur jelas,the 2024 presidential election dispute hearing kpu said please aniesmuhaimin blur clear
sidang sengketa pilpres 2024 kpu sebut mohon aniesmuhaimin kabur jelas,the 2024 presidential election dispute hearing kpu said please aniesmuhaimin blur clear
sidang sengketa pilpres 2024 kpu sebut mohon aniesmuhaimin kabur jelas,the 2024 presidential election dispute hearing kpu said please aniesmuhaimin blur clear
sidang sengketa pilpres 2024 kpu sebut mohon aniesmuhaimin kabur jelas,the 2024 presidential election dispute hearing kpu said please aniesmuhaimin blur clear
info loker parttime part time freelance freelancer ajar mahsiswa kuliah sekolah wfh iphone netflix disney viu joki wts wtb pc konser tiket debat milu capres cawapres amin anies imin pragi gibran mahfud 2q,locker info part time part time freelance freelancer teaching students school lectures wfh iphone netflix disney viu jockey wts wtb pc concert ticket debate milu vice president amin anies imin pragi gibran mahfud 2q
mau ajak kaya dadak sm pak anies malah milih meng kaya kan org serakah gitu deh dududuudu,want to invite rich dadak sm pak anies instead milih meng kaya kan orang greed gitu deh dududuudu
wkwkwkwkwk repot diri sendiri padahal pak anies udah bikin biar rakyat ribet,wkwkwkwkwk bother yourself even though Pak Anies has made the people complicated
buat bambu telan dana hingga rp550 juta karya seni ide anies baswedan cuma tahan 11 bulan karya seni lihat kumuh mahal malah cela ikn mau batal ikn untung menang ikn lanjut,make bamboo swallow funds up to Rp550 million artwork idea anies baswedan only lasts 11 months artwork look slum expensive even reproach ikn want to cancel ikn profit win ikn further
lah kocak lu cuma fokus debat lu liat debat pertama pak menhan nyerang kerja pak anies bahas ktp angin pak anies dengar santay senyum jawab data cuma gimmick gemoy muka mewek buat bahan buzzer nya bagai sosmed,well kocak you just focus on your debate see the first debate sir menhan nyerang kerja pak anies discuss ktp wind pak anies hear santay smile answer data only gimmick gemoy face mengek for his buzzer material like sosmed
wkwk nyata nya memang rakyat gamau ubah yaudah mau gmn kasih spek anies baswedan malah milih hmm,wkwk real it is the people gamau change it yaudah mau gmn kasih spec anies baswedan even milih hmm
neh mak nadiautk ngalahin seorg anies gelontor uang apbnsemua dikerahin,neh mak nadiautk defeated seorg anies gelontor wang apbnsall dikerahin
sbg jabat daerah sdng resmi rmh ibadah lalu dadak ada acara baptis mungkin anies sungkan tolak takut singgung jemaat situ kalau situ waras coba cri thu bgmn sosok nabi muhammad mata mrk biar kau faham toleransi ckup dng tdk ganggu mrk,sbg regional sdng official rmh worship and then dadak there is a baptism event maybe anies hesitant to refuse to be afraid of mentioning the congregation there if there is sane try cri thu bgmn the prophet figure muhammad eyes mrk let you understand tolerance ckup dng do not disturb mrk
bohong dunia politik lumrah bapake bahkan kali kali bohong anies klw mau jadi org jujur jadi pak kyai jgn jadi politikus,lie the political world is commonplace bapake even times lie anies klw want to be an honest person so sir kyai don't be a politician
anies kakek pahlawan indonesia,anies Indonesian hero grandfather
inget ketua projo bilangjika thn 2024 kalah masuk penjara semuasosiapa maling negara rocky gerung said anies lantik 2 minggu kemudian jokowi masuk penjara wkwkwkmaling becus kerja sini siapayaaajokowi kroni,"remember the head of projo said that if in 2024 he lost, he would go to jail all the way to the thief of the country rocky gerung said anies appointed 2 weeks later jokowi went to prison wkwkwkmaling becus work here readyayaaajokowi crony"
waktu coblos maren aku jadi kentut pantesan tau,coblos maren time I became a pantesan fart you know
kasus ah ah ah yohanies anies baswedan phd rasa anak paud enyap,case ah ah ah yohanies anies baswedan phd rasa anak paud enyap
siapa salah mas anies,who is wrong mas anies
wooowww klrga dokter aja percaya pak anies pimpin doa he is a true leader masha allah i am proud,wooowww klrga doctor aja believe pak anies lead the prayer he is a true leader masha allah i am proud
pak anies gw brengsek,pak anies gw jerk
allah memang suka orang takaburanies satu orang kemlintijanggar,allah does like people takaburanies one person kemlintijanggar
ini sosok sebut anies imam mahdi anies pendukingnya bantah piye mas aniessama aja kalah gimana mau ngalahin dajal awoawokawok,this figure call anies imam mahdi anies pendukingnya refute piye mas aniessama aja lose how to win dajal awoawokawok
gila benci sama orang sampe segitu nya hasil bunuh karakter nya sehat sehat pak anies,crazy hate people so much that the result of killing the character is healthy healthy pak anies
tenang mas usah emosi menang aja kok emosi pak anies sedang juang bangsa jatuh tangan orang orang etika koruptor dukung oligarki jangan jangan bagi satu kelompok sebut kok sangat takut,"calm down, mas, don't get emotional, just win, sir, emotions are fighting, the nation is falling into the hands of people, corrupt ethics, support oligarchy, don't let one group say, why are you so afraid?"
anies lantik,anies lantik
apa tanding anies,apa tanding anies
fitnah akhir zaman beneran ril bjirr mana pak anies mulu kena yh,end of time slander is real ril bjirr where pak anies mulu hit yh
sejak kakek anies juang merdeka indonesia bukan antek2 belanda,since the grandfather of Anies Juang Merdeka Indonesia is not a Dutch minion
bener harus parpol sedia caleg2 kompeten integritas pro rakyat biar wakil aspirasi rakyat mkn model kampanye kyk desak anies gitu caleg rakyat edukasi nyata justru money politics dipake,it is true that political parties must be ready for competent candidates for pro-people integrity so that representatives of people's aspirations mkn campaign model kyk urges anies so that people's calegs for real education actually use money politics
era anies anies jabat bukan jadi pimpin salah,era anies anies jabat not so pimpin salah
hah apa program anies,hah what anies program
anies main politik identitas hasut gibran kasih fasilitas kuasa sama buruk,anies play identity politics seduced by gibran love power facilities just as bad
bukan ranah anies baswedan kala jadi kemendikbud program kerja perluasaan akses tata kelola didik maksud,not the realm of anies baswedan when it became the Ministry of Education and Culture work program to expand access to student governance
semua salah anies tom lembong,all wrong anies tom lembong
org pak anies ngucapin bela sungkawa aja hujat ama akun porno inti mah mau 1000 baik bakal ketuk pintu hati kak kalo udh benci,org pak anies ngutapin bela condolences aja blasphemy ama account porno inti mah mau 1000 well will knock on the door of your heart if udh hate
lu mau mancing polarisasi anies murni sekuler nasionalis,you want to lure polarization anies pure secular nationalist
merespon dukung aniesdgn kalimat rupa harus jadi introspeksi dukung anies,respond to support aniesdgn visual sentences should be introspection support anies
enak aja hujat pak anies pak anies kan berhala pak jokowi sejak 2014 salah sama sekali ayo semua bela pak anies serang balik orang nyerang pak anies pokok pak anies is perfect,good blasphemy pak anies pak anies right idols pak jokowi since 2014 totally wrong let's all defend pak anies attack back people nyerang pak anies tree pak anies is perfect
